id,created_at,favorite_count,retweet_count,text
1649466440896872449,2023-04-21 17:33:39+00:00,125,33,*LYIN' BIDEN* https://t.co/PDkmbaKML5
1649442139707781122,2023-04-21 15:57:05+00:00,789,254,Another piece falls into place... https://t.co/wcn5IC7zeL
1649430750314262528,2023-04-21 15:11:50+00:00,169,35,Whoops... https://t.co/n2g49mKnJk
1649397081549709315,2023-04-21 12:58:03+00:00,445,114,“That document in the wrong person’s hands would be astronomically dangerous.” https://t.co/JsarLtBjAd
1649392019465293826,2023-04-21 12:37:56+00:00,324,39,"ELDER: “America is in decline, but this decline is not inevitable. We can enter a new American Golden Age, but we must choose a leader who can bring us there. That’s why I’m running for President."" https://t.co/NRCfRmBHwv"
1649384931787788288,2023-04-21 12:09:46+00:00,421,102,White House Denies IRS Whistleblower Allegations Of Mishandled Investigation Into Hunter Biden https://t.co/Um5OAn5jpt
1649371518680412160,2023-04-21 11:16:28+00:00,462,77,Blowing the whistle on Joe Biden https://t.co/PW1aGhFGIM
1649214094656847874,2023-04-21 00:50:55+00:00,158,23,"TEMPER TANTRUM: A video of a man having a meltdown over a baby crying on a plane has gone viral. TONIGHT on ""Hannity,"" we'll show you the clip, and @NBSaphierMD and @JimmyFailla will react."
1649210804414169095,2023-04-21 00:37:51+00:00,574,161,"*JOE'S BRAIN MELTS, FORGETS HOW TO SPELL* https://t.co/Xuwaf2ZfNh"
1649204486609551361,2023-04-21 00:12:45+00:00,418,68,*CLOWN SHOW* https://t.co/XY82MGfGf6
1649201186690543618,2023-04-20 23:59:38+00:00,216,30,"*JUST SAY NO, JOE!* https://t.co/tbR1rGMYrE"
1649112854295871498,2023-04-20 18:08:38+00:00,575,258,*JUST IN* https://t.co/zJJ03jRYPT
1649111618695856130,2023-04-20 18:03:43+00:00,306,57,Washington DC lawmakers are trying to silence your opinions.. and take away your favorite radio station while you’re on the road!  Text “AM” to 52886 and tell Congress to keep AM radio in all new cars and trucks! https://t.co/PrJwTmhuQ8 https://t.co/HxWAUjdR1Q
1649109310591336460,2023-04-20 17:54:33+00:00,2008,296,MACE: “My girl is an athlete. I cannot imagine her having to be put in that position where there’s a biological male in her locker room...We have worked too damn hard to put up with the bulls— of the left that wants to take our achievements away from us.” https://t.co/QQGvbNTaAU
1649079697899151360,2023-04-20 15:56:53+00:00,408,49,*WOKE IN RUINS* https://t.co/WyRKxoAu4Q
1649076154374975492,2023-04-20 15:42:48+00:00,1394,182,*CONSERVATIVES STAND UP* https://t.co/eKwOIwbqdY
1649065522158264322,2023-04-20 15:00:33+00:00,359,46,Cuts are coming for EPSN... https://t.co/RDAdhJ6YnS
1649058434740830209,2023-04-20 14:32:23+00:00,288,30,"""The rocket, which is poised to take astronauts to the moon as early as 2025, did not reach orbit, but the test run drew cheers from the control center after the ship climbed to dozens of miles in the atmosphere."" https://t.co/y3TEbc7Ziu"
1649054976298344456,2023-04-20 14:18:38+00:00,797,152,"Above The Law?  IRS Whistleblower Says Hunter Biden Receiving ""Preferential Treatment"" https://t.co/3AdcAAbCxW"
1649049829098815492,2023-04-20 13:58:11+00:00,3403,518,*WALLS CLOSING IN* https://t.co/NNR5krIezX
1649042994324987905,2023-04-20 13:31:02+00:00,534,59,How about you were ratings poison and your show was awful? https://t.co/fdPZ0lZWKs
1649038438195245056,2023-04-20 13:12:55+00:00,508,71,Hannity and Rubio dig into the latest COVID bombshell... https://t.co/TkMFBDZXIN
1649026788822073345,2023-04-20 12:26:38+00:00,252,28,Hannity: Your tax dollars are hard at work in this Biden administration dumpster fire https://t.co/vAFJX09tVg
1648851678693584897,2023-04-20 00:50:49+00:00,870,108,"VIVEK SCHOOLS DON LEMON: GOP presidential candidate @VivekGRamaswamy DESTROYED Don Lemon in a heated debate. TONIGHT on ""Hannity,"" we'll show you the tape and speak with Ramaswamy."
1648849148605595650,2023-04-20 00:40:45+00:00,223,24,"BIDEN'S BLUNDERS: Earlier today, President Biden completely bungled his remarks on the economy! Tune into ""Hannity"" TONIGHT to see the lowlights, and to hear @Larry_Kudlow's economic analysis!"
1648846617988964354,2023-04-20 00:30:42+00:00,434,68,"CDC HELD ACCOUNTABLE: @SenMarcoRubio and Rep. Dan Crenshaw recently introduced legislation that would force the CDC to make its COVID data public. TONIGHT on ""Hannity,"" we'll speak with Senator Rubio."
1648844086860816387,2023-04-20 00:20:39+00:00,545,128,"IRS WHISTLEBLOWER BOMBSHELL: @JSolomonReports will join ""Hannity"" TONIGHT with a full report on the senior IRS agent who is accusing Biden's DOJ of mishandling the Hunter Biden probe. PLUS, Oversight Committee Chairman @RepJamesComer will react."
1648841556437225473,2023-04-20 00:10:35+00:00,605,72,"BAD NEWS, BRAGG: A federal judge denied Manhattan DA Alvin Bragg's request to block the subpoena of Mark Pomerantz. TONIGHT on ""Hannity,"" @GreggJarrett and @EmilyCompagno will discuss."
1648797109359869958,2023-04-19 21:13:58+00:00,398,142,BOMBSHELL: Records Show Funding for EcoHealth/Wuhan Institute to Create COVID ‘Mutants’; Report https://t.co/FivRVWZRyG
1648789386153082883,2023-04-19 20:43:17+00:00,322,67,BETTER? DON’T ‘FET’ ON IT! Fetterman Struggles During Senate Comeback [WATCH] https://t.co/ggoBycjGgD
1648783594423308289,2023-04-19 20:20:16+00:00,390,70,"‘WHY AREN’T PEOPLE BUYING IT?’: Doocy Challenges Biden’s View of Economy, KJP Scrambles [WATCH] https://t.co/fk4Jk5khVB"
1648780827872964608,2023-04-19 20:09:16+00:00,489,188,*SHOCKING NEW DEVELOPMENTS* https://t.co/drXht87cVh
1648777891272859656,2023-04-19 19:57:36+00:00,1008,125,RAND SLAM: ‘Fauci Deserves Culpability and History is Going to Judge Him Poorly’ [WATCH] https://t.co/IfgXXWBzQw
1648761340238913562,2023-04-19 18:51:50+00:00,689,89,*UNFIT* https://t.co/Px9FjxijT1
1648755269541715982,2023-04-19 18:27:43+00:00,993,143,"HOLY MITT! Romney Rips Mayorkas, Says ‘Complete the Wall,’ Gives Admin Failing Grade https://t.co/FWg1rMglwV"
1648750457718820864,2023-04-19 18:08:36+00:00,456,58,*AMERICANS AREN'T BUYING IT* https://t.co/XhSJC4l4Ka
1648737834532995101,2023-04-19 17:18:26+00:00,743,170,NY POST: ‘Biden is Letting China Dodge Responsibility for COVID — What Else?’ https://t.co/IUPXzRarCA
1648726347080925189,2023-04-19 16:32:47+00:00,144,15,ATTITUDE ERA: Sore Loser Youth Wrestler Sucker Punches Opponent After Loss [WATCH] https://t.co/YTNHivwQ4x
1648720626566283266,2023-04-19 16:10:03+00:00,407,75,MAYORKAS IN DENIAL: Border Bum Says ‘It is My Testimony That The Border is Secure’ [WATCH] https://t.co/k2r16R6LHX
1648718576772173831,2023-04-19 16:01:55+00:00,898,154,*NY POST TORCHES JOE* https://t.co/wagpSPT0Tx
1648715203020832768,2023-04-19 15:48:30+00:00,322,89,‘THEY WERE GOING TO KILL US’: Chicago Couple Attacked by Mob Speaks Out [WATCH] https://t.co/Hy84k3MPNe
1648713768778489856,2023-04-19 15:42:48+00:00,1184,218,“You are failing miserably… Do you not care? Do you not have just an ounce of human compassion?… You just sit there looking with a blank look on your face.” https://t.co/0CCzyN46ZL
1648711997679075328,2023-04-19 15:35:46+00:00,6,4,@CurtisSliwa @larryelder slam new Chicago mayor and AOC for far-left platforms https://t.co/sHbBaVAaRA
1648708883026722817,2023-04-19 15:23:23+00:00,328,60,"CACKLIN’ KAMALA: Veep Tries Her Best to Joke, Ends Up in Creepy, Cringey Laughing [WATCH] https://t.co/k6W2KgJuF8"
1648703900587892737,2023-04-19 15:03:35+00:00,228,25,Bad sportsmanship goes viral... https://t.co/ciFkOx3G23
1648703685579423750,2023-04-19 15:02:44+00:00,529,109,"SORRY, META —YOU’RE ZUCK’D! 4,000 Employees to Be Fired From Social Media Giant https://t.co/UtWzQpiuf0"
1648693018277421065,2023-04-19 14:20:21+00:00,355,59,She literally slaps her knee... https://t.co/lY1a1RoEHX
1648687151691726850,2023-04-19 13:57:02+00:00,455,44,"DISINGENUOUS DEMS! Lahren Lampoons the Left, Only Care About ‘Climate Change and Rainbows’ [WATCH] https://t.co/OE9TUukD2w"
1648686435602497537,2023-04-19 13:54:12+00:00,320,31,"“It’s about to be Hunger Games out here."" https://t.co/K9IDs08x7F"
1648659101591691268,2023-04-19 12:05:35+00:00,395,47,Dems Do Not Care About Real Issues Except Climate Change and Unicorns @TomiLahren  https://t.co/sFyAO5covH
1648651510727729152,2023-04-19 11:35:25+00:00,336,42,Biden admin officials sounded like fools on Capitol Hill https://t.co/2Bp4imhSHO
1648489297396334592,2023-04-19 00:50:50+00:00,450,70,"BIDENOMICS: A recent CNBC survey found that 69% of Americans are unhappy with Biden's economy. @PeteHegseth and @BrianBrenberg will discuss TONIGHT on ""Hannity."""
1648486766528303107,2023-04-19 00:40:47+00:00,135,20,"CRIME CRISIS: Tune into ""Hannity"" TONIGHT to see SHOCKING crime videos. PLUS, @LarryElder and @CurtisSliwa will weigh in."
1648484235160743936,2023-04-19 00:30:43+00:00,466,58,"SAVE WOMEN'S SPORTS: Former NCAA champion @Riley_Gaines_ will join ""Hannity"" TONIGHT to explain why she’s eviscerating Biden for not protecting women’s sports. Tune in at 9 PM ET or set your DVR!"
1648481703629844480,2023-04-19 00:20:40+00:00,346,64,"BAD BIDEN APPOINTEES: Multiple Biden administration officials embarrassed themselves on Capitol Hill today. TONIGHT on ""Hannity,"" we'll show you the lowlights, and @StephenM, @TomiLahren and @CharlesHurt will react."
1648427013462708224,2023-04-18 20:43:20+00:00,630,65,"BUD BASHER: DeSantis Says Bud Got Too Woke, ‘Why Would Anyone Want to Drink It?’ https://t.co/g0lRP1vQtt"
1648421581864210432,2023-04-18 20:21:45+00:00,2189,279,‘YOU SHOULD HAVE RESIGNED LONG AGO!’: Sen. Hawley Blasts Mayorkas for Border Failures https://t.co/7cX7EkilAx
1648416224911687680,2023-04-18 20:00:28+00:00,207,17,GOOD TO GO: Bills’ Damar Hamlin Ready to Return Just Months After On-Field Collapse https://t.co/bQrMVb9fPV
1648409832616235008,2023-04-18 19:35:04+00:00,1548,210,TOUGH GAINES: Riley Rips Joe for Failing to Protect Women’s Sports in Favor of ‘Radical Minority’ https://t.co/KuC6591VOP
1648388244109664264,2023-04-18 18:09:17+00:00,404,74,"THE ECONOMY STINKS, JOE! Pessimism on Economy Hits Record High, New Poll Shows [READ IT] https://t.co/zElWudGO29"
1648385779897446402,2023-04-18 17:59:30+00:00,2395,392,"GAINES: ""The president has declared that science, truth, and common sense no longer matter."" https://t.co/DViLA8Ce2g"
1648383250035777553,2023-04-18 17:49:26+00:00,204,20,"""He’s fully cleared, he’s here, and he is of the mindset – he is in a great headspace – to come back and make his return.” https://t.co/8sv7n5OYdl"
1648377827044081676,2023-04-18 17:27:54+00:00,726,115,THE GREAT ONE: Levin UNLOADS on the Biden Crime Family and ‘Mob Lawyer’ Merrick Garland [WATCH] https://t.co/9a8uWXDWhc
1648359715615784963,2023-04-18 16:15:55+00:00,891,166,"""A record 69% of the public holds negative views about the economy both now and in the future, the highest percentage in the survey’s 17-year history."" https://t.co/JPdyXI1epi"
1648357944755363841,2023-04-18 16:08:53+00:00,3025,623,"LEVIN: “By God, it’s time for Republicans to fight back, to run on the edge of the Constitution, to see what they can do because we’re going to lose the country otherwise. This corrupt President and his family are taking us under.” https://t.co/TUo0ZyCE63"
1648357685333508097,2023-04-18 16:07:51+00:00,506,113,"CRUZ MISSILE! Ted Talks Crime, ‘Democrats Don’t Give a Damn About the Body Bags Piling Up!’ [WATCH] https://t.co/fdcr4pYSY1"
1648351914864570368,2023-04-18 15:44:56+00:00,419,130,SHOCK ATTACK! Criminal With 11 Priors Attacks NYPD Officer with Bottle in Broad Daylight [WATCH] https://t.co/RIX4hlA7yO
1648346832651550720,2023-04-18 15:24:44+00:00,167,56,"MARCH MADNESS! 191,900 Migrant Encounters Logged at the Border Last Month! https://t.co/g72zjNBXvz"
1648340451034841089,2023-04-18 14:59:22+00:00,585,88,"SCHIFF END OF THE STICK: Heckler at NYC Hearing Calls Adam Schiff ‘Scumbag,’ Is Removed [WATCH] https://t.co/pbmdWsBJsI"
1648337200667320320,2023-04-18 14:46:27+00:00,617,204,*BRAGG'S NYC* https://t.co/f8K2Xl5GrB
1648335195722993664,2023-04-18 14:38:29+00:00,984,240,BIDEN CRIME FAMILY: Comer Says Six More Biden Family Members Benefitted from Schemes [WATCH] https://t.co/rFbqwwixul
1648327078759002114,2023-04-18 14:06:14+00:00,1586,163,*THEY SHOULD HAVE REMOVED SCHIFF!*  https://t.co/N9Zn5bOkK1
1648321253353062401,2023-04-18 13:43:05+00:00,2804,707,"COMER: ""We’ve identified six additional members of Joe Biden’s family who may have benefited from the Biden family’s businesses that we are investigating, bringing the total number of those involved or benefiting to nine.” https://t.co/Wr9WlX5Tpi"
1648314669294034944,2023-04-18 13:16:56+00:00,190,69,Up 25% from February... https://t.co/5tJI4zTlsW
1648311884318121987,2023-04-18 13:05:52+00:00,229,39,Democrats don’t want to talk about crime https://t.co/msRXBFfVjy
1648304288441982982,2023-04-18 12:35:41+00:00,247,34,"Hearing witness Madeline Brame torches Reps. Johnson, Goldman, Schiff after testifying about slain son https://t.co/IHfn1V1f3c"
1648296692742074368,2023-04-18 12:05:30+00:00,186,35,@SpeakerMcCarthy explains his plan to raise the debt ceiling https://t.co/mbKLNY1LQU
1648293148542607361,2023-04-18 11:51:25+00:00,541,123,Mayor Lightfoot on Violent Riots in Chicago: ‘It’s Wrong to Say that It’s Mayhem’ https://t.co/uXYeWmRJlI
1648280739840925698,2023-04-18 11:02:06+00:00,283,32,We put a national spotlight on New York City's crime problem @Jim_Jordan https://t.co/OVNq3h6gIc
1648126802706018304,2023-04-18 00:50:25+00:00,575,62,"BAD MOVE, BUD: Anheuser-Busch tried to win fans back with a patriotic ad after Bud Light’s controversial partnership with Dylan Mulvaney, but beer drinkers were not impressed! TONIGHT on ""Hannity,"" @JimmyFailla and @KayleighMcEnany will react."
1648124270051033090,2023-04-18 00:40:21+00:00,624,134,"BIDEN FAMILY CRIME SYNDICATE: House Oversight Committee Chairman James Comer says there are six other Biden family members who ""may have benefited"" from Hunter's shady business dealings. @MarkLevinShow will react TONIGHT on ""Hannity."""
1648121737375014912,2023-04-18 00:30:17+00:00,328,57,"HIDIN' BIDEN: @SpeakerMcCarthy says the White House hasn't reached out since his first meeting with President Biden nearly three months ago! Speaker McCarthy will join ""Hannity"" TONIGHT."
1648119204120256514,2023-04-18 00:20:13+00:00,363,55,"NEW YORK CRIME: Madeline Brame blasted Manhattan DA Alvin Bragg today over the botched murder investigation into her slain veteran son. She joins “Hannity” to discuss the House Judiciary Committee's field hearing, PLUS @SenTedCruz and Rep. @Jim_Jordan will weigh in."
1648103524847308800,2023-04-17 23:17:55+00:00,793,104,"HE’S BAAAAAAAACK: Fetterman Returns to the Hill, Looks Terrible https://t.co/eJgtHLCoQu"
1648098472325705732,2023-04-17 22:57:50+00:00,431,119,‘ONLY EXPLANATION’: Frmr Intelligence Dir. Ratcliffe to Testify COVID Came From Lab [READ IT] https://t.co/Vhg1ZC5AV7
1648091344642928641,2023-04-17 22:29:31+00:00,254,32,FETTERMAN: “It’s great to be back.” https://t.co/q9vifPdiHS
1648078642704990210,2023-04-17 21:39:02+00:00,455,73,Trump Endures Nearly 7 Hours In Deposition By NY Attorney General Related To Real-Estate https://t.co/QhFsGr9aN9
1648035744194207744,2023-04-17 18:48:35+00:00,626,110,"BIG APPLE BLOWOUT! Jordan, Judiciary Search for Answers Amid Skyrocketing Crime in NYC [WATCH] https://t.co/fHGPKOnfqD"
1648025622772326400,2023-04-17 18:08:21+00:00,491,72,#DemocratCrimeCrisis: New York Rep Elise Stefanik Calls NYC the ‘Epicenter’ of the Crime Crisis [WATCH] https://t.co/jgVDy3gv6e
1648011997496193024,2023-04-17 17:14:13+00:00,147,31,"‘FLIPPING’ OUT: Watch Clash on Campus as Trans Activist Flips TPUSA Table, ‘Get the F*** Off My Campus!’ https://t.co/IrdAgmUE4G"
1647991008846655489,2023-04-17 15:50:49+00:00,464,107,"CHAOS IN THE WINDY CITY! Teenagers Riot in Chicago, Two Shot, Mayor-elect Says Don’t ‘Demonize’ Them [WATCH IT] https://t.co/IKGBpb1gt9"
1647985133943660547,2023-04-17 15:27:28+00:00,607,62,"A BETTER MOUSE TRAP: DeSantis Set to Unveil New Disney Crackdown, He Will ‘Have the Last Laugh’ https://t.co/WvYrzY9GTa"
1647979991009828865,2023-04-17 15:07:02+00:00,2302,274,"TENNESSEE FOR TRUMP: Blackburn Backs Don, ‘Can’t Wait Until He’s Back in the White House’ https://t.co/Oc7pG1KVvX"
1647957824318631939,2023-04-17 13:38:57+00:00,771,117,"‘INSULTING!’: Bud Drops pro-America Ad in Response to Mulvaney Backlash, Gets Blasted [WATCH IT] https://t.co/TV6170Qpwv"
1647275311317282819,2023-04-15 16:26:53+00:00,237,45,@TomCottonAR Biden's weakness is emboldening our enemies https://t.co/By7JOTPYKW
1647227711893454848,2023-04-15 13:17:45+00:00,741,146,China's 'dangerous coalition' is growing https://t.co/62EqvhidFH
1647221606605897729,2023-04-15 12:53:29+00:00,1013,76,Woman Demanding Reparations at Target Gets Punched by Security Guard https://t.co/3UK2BXCnM9
1647194545308811266,2023-04-15 11:05:57+00:00,1264,256,"Biden in Ireland repeats a debunked lie that he ""traveled 17,000 miles"" with Xi Jinping — then starts screaming about ""POSSIBILITIES."" https://t.co/HaegIbGFYe"
1647012767088427009,2023-04-14 23:03:38+00:00,433,153,NAKED AND AFRAID: LA Business Owners Have to Worry About Nude Homeless Camps Now [SEE IT] https://t.co/wGVOQX6A3A
1647006136007028736,2023-04-14 22:37:17+00:00,701,100,"WAIT! WE CAN STILL BE BUDS! Beer Exec Issues Apology, Doesn’t Mention Mulvaney [READ IT] https://t.co/N9iSh3Cjz1"
1647000484140417031,2023-04-14 22:14:49+00:00,552,155,"ALL DRESSED UP, NOWHERE TO GO: No Prison for Luggage and Clothing Thief Sam Brinton https://t.co/uXml0v62kr"
1646962903608709132,2023-04-14 19:45:29+00:00,6722,792,"MUSK: ‘If You Sterilize Kids Before They Are Consenting Adults, You Should Go to Prison for Life!’ https://t.co/bWRCM82Tua"
1646957263909801985,2023-04-14 19:23:05+00:00,573,103,"NO THANKS, JOE! Biden Tells Ireland ‘Let’s Go Lick the World’ in Bizarre Rant [WATCH] https://t.co/QE51HPE95S"
1646933136008261632,2023-04-14 17:47:12+00:00,1158,212,"BROTHER, CAN YOU SPARE A DIME? Pathetic Cohen Launches GoFundMe to Fight Trump Lawsuit https://t.co/44vdYpfSK8"
1646928023315177496,2023-04-14 17:26:53+00:00,2227,208,"KEEP HIM! Creepy Uncle Joe Says He’s Not Coming Back From Ireland, ‘I’m Staying Here’ [WATCH] https://t.co/T1fFPFNP6c"
1646908813646110723,2023-04-14 16:10:33+00:00,1318,251,"‘JOE IS LYING, HE IS WRONG’: Hannity UNLOADS on Biden for Downplaying Document Leak [WATCH] https://t.co/WJBN6r81Rz"
1646891234957447174,2023-04-14 15:00:42+00:00,1212,159,"FIGHTING FOR LIFE: DeSantis Signs Heartbeat Protection Act, Says Florida a ‘Pro-Family’ State https://t.co/Oh1AF1cLg0"
1646885542640906241,2023-04-14 14:38:05+00:00,1435,190,"‘IT’S PISSING PEOPLE OFF!’: Ted Torches Bud, NFL for ‘Looking Down’ at Their Typical Customers https://t.co/RJBRGzvsi4"
1646874035995697152,2023-04-14 13:52:22+00:00,929,171,Government Funded Crack Pipes? https://t.co/AjnS0Dje9E
1646848060411052034,2023-04-14 12:09:09+00:00,302,52,How bad is the Pentagon leak? https://t.co/VOvbfgHviK
1646844230390759425,2023-04-14 11:53:56+00:00,1259,155,The whole country knows about the 'witch-hunt' for Donald Trump @PamBondi https://t.co/YlKCherhQf
1646677388791521282,2023-04-14 00:50:57+00:00,807,103,"BUD BUSTED: Bud Light's decision to partner with trans influencer Dylan Mulvaney has cost its parent company Anheuser-Busch billions in market value! TONIGHT on ""Hannity,"" @JimmyFailla and @TomiLahren will react."
1646674856941965312,2023-04-14 00:40:54+00:00,561,118,"TENNESSEE THREE: We have pictures of one of the so-called “Tennessee Three” standing on a cop car during the 2020 riots.  @TheLeoTerrell and @DavidWebbShow will react TONIGHT on ""Hannity."""
1646672324626726912,2023-04-14 00:30:50+00:00,191,32,"WITCH HUNT CONTINUES: @AlanDersh and @PamBondi will discuss New York’s latest legal targeting of former President Trump TONIGHT on ""Hannity."" Tune in at 9 PM ET or set your DVR!"
1646669792823107584,2023-04-14 00:20:46+00:00,152,21,"GREEN NEW DICTATOR: The Biden administration is pushing for an extreme crackdown on car emissions. @SecretaryPerry will weigh in TONIGHT on ""Hannity."""
1646667260944166914,2023-04-14 00:10:43+00:00,305,43,"BIDEN'S SPRING BREAK: Why is President Biden acting like a tourist vacationing in Ireland? TONIGHT on ""Hannity,"" we'll show you the latest embarrassing lowlights, and @KayleighMcEnany and @TudorDixon will react."
1646664729039912960,2023-04-14 00:00:39+00:00,146,20,"LEAK INVESTIGATION: @KevinCorke will join ""Hannity"" TONIGHT with a full report on the arrest of Massachusetts Air National Guardsman Jack Teixeira, who is accused of leaking classified documents."
1646634707445075968,2023-04-13 22:01:21+00:00,692,101,"WHO’S NEXT? PBS Joins NPR in Being Twitter Quitters, ‘We Have No Plans to Resume’ https://t.co/vpbdhSzy0Q"
1646629304531316736,2023-04-13 21:39:53+00:00,861,112,"BUD FRIGHT! Beer Execs Blindsided by Mulvaney Partnership, Pausing Future Campaigns for Review https://t.co/RyN7HKycL9"
1646620663942184963,2023-04-13 21:05:33+00:00,1334,165,Hannity Panel: Trump Lawsuit Against Michael Cohen: ‘Good Move;’ ‘A Legitimate Suit’ https://t.co/f7pCs8Zvlo
1646599339706404874,2023-04-13 19:40:49+00:00,402,73,LEAKER LOCATED? Ukraine Docs Leaked by 21-Year-Old Air National Guardsman https://t.co/ABAUAw0rEz
1646594292692013063,2023-04-13 19:20:46+00:00,1512,263,"‘DIRE THREAT!’: Trump Unloads on Corrupt Weaponization of DOJ, ‘They are Marxists’ https://t.co/Zhz10mH4M9"
1646588377276338178,2023-04-13 18:57:15+00:00,641,183,"UNCLE JOE’S MELTDOWN: Biden Tells Bogus Xi Story in Ireland, Starts SCREAMING About “Possibilities’ [WATCH] https://t.co/LftaX98ZDQ"
1646573690102972436,2023-04-13 17:58:54+00:00,2521,317,DEFUND THE DA! GOP Rep Intros Legislation to Defund NYC DA Alvin Bragg’s Office https://t.co/I2Iyw07nse
1646560398521294850,2023-04-13 17:06:05+00:00,2495,327,GOP Senators Introduce Legislation To Defund Sanctuary Cities https://t.co/vUlodOLUx4
1646554037322383362,2023-04-13 16:40:48+00:00,367,51,"NOT ‘FEIN’: 89-Year-Old Feinstein Missing Key Votes, Own Party Calling for Resignation https://t.co/n7RA14k323"
1646537609110323202,2023-04-13 15:35:31+00:00,296,40,Protesters Resort to Violence Because They Have No Other Way to Persuade You @Riley_Gaines_ https://t.co/eKW4Yqd6md
1646536096241598467,2023-04-13 15:29:31+00:00,1134,213,EMPIRE HATE: Nearly a Third of New Yorkers Want Out Due to Crime and Cost of Living; Poll https://t.co/1zcNSN0W8r
1646529431345692672,2023-04-13 15:03:02+00:00,1889,218,COHEN ON THE ROPES! Trump Sues Former Lawyer for $500 Million in Damages [WATCH] https://t.co/E5JmUaoxAV
1646523786735554571,2023-04-13 14:40:36+00:00,1889,381,‘THE FIGHT OF ALL FIGHTS!’: ‘Burn Your Nike Bra’ Challenge Begins in Protest of Trans Partnership https://t.co/NDmzicmxpq
1646522670899683329,2023-04-13 14:36:10+00:00,562,157,Real Wages Of American Workers Continued To Fall Last Month Due To Inflation https://t.co/2XvQejtAI7
1646518745064701952,2023-04-13 14:20:34+00:00,318,31,"TWEETWISE: Elon Musk Has Fired 80% of Twitter’s Staff, ‘If the Ship Sinks, Nobody Has a Job!’ https://t.co/SsJEhojzqM"
1646499880620158977,2023-04-13 13:05:36+00:00,247,33,A new axis of evil is forming right before our eyes https://t.co/iJeb5yHBsx
1646492285020823555,2023-04-13 12:35:25+00:00,315,63,Black conservatives are attacked by the left: @ByronDonalds https://t.co/YgYJlyf5Mi
1646485954960424960,2023-04-13 12:10:16+00:00,1029,255,Biden Gets Confused After His Speech in Ireland So Hunter Tells Him Where to Go https://t.co/r1tipjcPKx
1646309770792513538,2023-04-13 00:30:10+00:00,360,42,"REALLY, JEFFRIES?: Democrat House Minority Leader Rep. Hakeem Jeffries is in hot water after insulting Black conservatives. TONIGHT on ""Hannity,"" Rep. @ByronDonalds will react."
1646307238477168646,2023-04-13 00:20:07+00:00,310,28,"TRUMP SUES COHEN: @AlanDersh and @GreggJarrett will discuss former President Trump’s lawsuit against Michael Cohen TONIGHT on ""Hannity."""
1646304959963492354,2023-04-13 00:11:03+00:00,325,53,"DUBLIN THE EMBARRASSMENT: While America's adversaries are busy at work, President Biden is embarrassing himself in Ireland! TONIGHT on ""Hannity,"" we'll show you the lowlights, and @PeteHegseth and @StephenM will react."
1646304200140128256,2023-04-13 00:08:02+00:00,328,76,U.S. Officials Trying To ‘Reassure’ Allies After Alleged Top Secret Intel Leaks https://t.co/CpjS8d56Oq
1646303947085185024,2023-04-13 00:07:02+00:00,725,71,"DON'T MESS WITH MUSK: Elon Musk called out a BBC reporter who complained about ""hateful content"" on Twitter, but couldn't think of a single example. TONIGHT on ""Hannity,"" we'll show you the clip, and @JimmyFailla and @DagenMcDowell will react."
1646253542355681282,2023-04-12 20:46:45+00:00,3880,594,"BOLD AT THE BORDER: McCarthy Says Time to Send Troops, Designate Cartels as Terrorists https://t.co/eGBeL5i2m5"
1646242532085334018,2023-04-12 20:03:00+00:00,350,65,"KID JOE: Biden Takes Questions from Kids, Gets Distracted by Toy Plane [WATCH] https://t.co/obwYIkyGOI"
1646225404896636928,2023-04-12 18:54:56+00:00,221,22,TIM’S TIME? Scott Announces Exploratory Committee for President of the United States [WATCH] https://t.co/MCtUdg8qmv
1646219960430080000,2023-04-12 18:33:18+00:00,1252,155,"MUSK NUKES BBC BUM: Reporter Claims Spike in Hate Speech on Twitter, Can’t Name Example https://t.co/BCSZUINp92"
1646204544810991632,2023-04-12 17:32:03+00:00,837,84,TWITS QUIT! NPR Leaves Twitter After Being Labeled ‘State-Affiliated Media’ [READ THE STATEMENT] https://t.co/bJPjFKk4OE
