id,created_at,favorite_count,retweet_count,text
1588687680094830593,2022-11-05 00:20:33+00:00,956,103,"RED TSUNAMI COMING? @RobertCahaly and @MattTowery will join ""Hannity"" TONIGHT with the latest polling. Is a red tsunami on the way? Tune in at 9 PM ET or set your DVR!"
1588685046218690560,2022-11-05 00:10:06+00:00,324,47,"MIDTERMS 4 DAYS AWAY: @BillHemmer will tell you which key indicators to look for on Tuesday night. PLUS, @SenTedCruz and GOP House candidate @CasandraLGarcia will discuss TONIGHT on “Hannity.”"
1588682564809752579,2022-11-05 00:00:14+00:00,607,73,"DESPERATE AND ANGRY: The Democrats know that the midterm elections will not be good for them, and they are lashing out. TONIGHT on ""Hannity,"" we'll show you the lowlights, and @NewtGingrich will react."
1588661072420028417,2022-11-04 22:34:50+00:00,677,168,CLUELESS KAT! NY Gov Says GOP Being ‘Dishonest’ On Crime While Splitscreen Shows Rising Crime Stats https://t.co/y4X1ujnBXa
1588635022755594240,2022-11-04 20:51:19+00:00,826,213,"NOW YOU NBC IT, NOW YOU DON’T! Story Claiming Pelosi Didn’t Indicate ‘Emergency’ to Cops Taken Down https://t.co/N90R1lzt6Y"
1588621640090394624,2022-11-04 19:58:08+00:00,492,81,Every race is ‘that close’ that you are the deciding vote https://t.co/r7bE5QQCWz
1588613164140208129,2022-11-04 19:24:27+00:00,353,78,"CLYBURN’S CLAIM: If GOP Wins, America On Track to ‘Repeat What Happened in 1930s Germany’ https://t.co/41Sk1xykfn"
1588603595498332161,2022-11-04 18:46:26+00:00,1036,136,"READY TO POUNCE: McCarthy Talks ‘Day One’ of GOP Majority, ‘We’ll Get Answers Americans Deserve’ https://t.co/OZgByjvaKx"
1588597270764740608,2022-11-04 18:21:18+00:00,1729,272,"STACEY SNUBBED! Top Georgia Dem Endorses GOP’s Kemp over Abrams, ‘Someone Georgians Can Trust’ https://t.co/bLSbvGmSqt"
1588587593645563905,2022-11-04 17:42:51+00:00,1320,197,"‘WE’RE TIRED OF BEING SILENCED’: Lake Blasts Big Tech, Mainstream Media, Cancel Culture https://t.co/9BwPAsBgM1"
1588579652754350083,2022-11-04 17:11:18+00:00,752,143,THE LEFT IS LOSING IT! MSNBC Says if GOP Wins Children Could Be ‘Arrested And Conceivably Killed’ https://t.co/zUfusC5cEu
1588567533711392769,2022-11-04 16:23:08+00:00,775,96,OK SCHUMER: Chuck Says ‘Dems Will Hold the Senate and Pick Up a Few Seats’ https://t.co/fxPt4IymaJ
1588548824573911047,2022-11-04 15:08:48+00:00,466,57,"#TWITTERLAYOFFS: Musk Sends Email Announcing Cuts, Employees File Class-Action Lawsuit https://t.co/HTKnl9OLmf"
1588530869702123521,2022-11-04 13:57:27+00:00,7246,825,"RETURN OF THE MAGA KING? Trump to Announce White House Run on November 14th, Report https://t.co/GJ2i8e7jBF"
1588503520847732736,2022-11-04 12:08:46+00:00,6103,701,"Kari Lake Jokes About Hillary Clinton Badmouthing Her: ‘I’m in Perfect Health, My Brakes on My Car Are in Good Shape, and I’m Not Suicidal’ https://t.co/LXKz8XT9gX"
1588388964242788353,2022-11-04 04:33:34+00:00,334,119,Fed Chair Jerome Powell Warns ‘There’s No Sense That Inflation Is Coming Down’ https://t.co/GGxHdKbKLv
1588345855362441220,2022-11-04 01:42:16+00:00,940,158,Hillary Clinton: ‘emphasis on crime’ is just Republicans trying to ‘scare voters’ https://t.co/aFEPFXJy3C
1588332721142636544,2022-11-04 00:50:05+00:00,1167,159,"LAKE AND BLAKE: Arizona GOP gubernatorial candidate @KariLake and Republican Senate candidate @BGMasters will join ""Hannity"" TONIGHT to discuss their campaigns."
1588330208167428098,2022-11-04 00:40:06+00:00,415,54,"""THE GREAT ONE"" RETURNS: The midterms are just 5 days away! ""The Great One,"" @MarkLevinShow will tell you what's at stake TONIGHT on “Hannity.” Tune in at 9 PM ET or set your DVR!"
1588327674321199109,2022-11-04 00:30:01+00:00,1760,409,"COMPARING REPUBLICANS TO ROACHES: ""The View"" co-host Sunny Hostin compared Republican women to ""roaches voting for Raid."" TONIGHT on ""Hannity,"" @HeyTammyBruce and Pete Hegseth will react."
1588294950055251969,2022-11-03 22:19:59+00:00,865,88,A FEW NUGGETS SHORT OF A HAPPY MEAL: AOC Says Musk Messing With Her Twitter Account https://t.co/QTyOsJ2ZJg
1588289567677124608,2022-11-03 21:58:36+00:00,330,50,"OH NO, BETO! Lifetime Candidate Beto O’Rourke Turns to TikTok for Votes, Thrusts Hips Creepily https://t.co/Rfk3Luu0Kt"
1588275971580461056,2022-11-03 21:04:35+00:00,394,52,ONE ‘ZEL’ OF AN ENDORSEMENT! It’s Official —NYC’s Naked Cowboy Backs Zeldin https://t.co/2bA3nbfq74
1588269187755040768,2022-11-03 20:37:37+00:00,96,20,"@GOPLeader on GOP plan to fix inflation, reduce crime and secure the border https://t.co/eNku6xrYVw"
1588260845124976640,2022-11-03 20:04:28+00:00,752,134,"With Democrats in charge, the suffering will only get worse https://t.co/ljd2SRcZzA"
1588250041881198593,2022-11-03 19:21:32+00:00,1901,213,"BIBI’S BACK! Israel’s Benjamin Netanyahu Wins Election Bid, Third Stint as Prime Minister https://t.co/dP500yKi36"
1588243718796374018,2022-11-03 18:56:25+00:00,2028,210,SOUR LEMON: CNN’s New Morning Show with Don Lemon BOMBS in the Ratings https://t.co/4edlvAELh5
1588237529186287617,2022-11-03 18:31:49+00:00,262,59,Karine Jean-Pierre Makes Bizarre Claim For Why Biden Is ‘Optimistic’ About Midterms https://t.co/UifQwnu5j0
1588229647694671874,2022-11-03 18:00:30+00:00,1811,156,FETTERMAN FALLS BEHIND: New Poll Shows Dr. Mehmet Oz Ahead of the Struggling Dem https://t.co/cV7Jd6vfDR
1588221597684740096,2022-11-03 17:28:31+00:00,1207,204,"‘WHAT DELUSION LOOKS LIKE’: Biden Blasted for Divisive Speech, Will Only Boost GOP https://t.co/O8UVx8ZBIV"
1588205111427436544,2022-11-03 16:23:00+00:00,2961,251,‘YOUR FEEDBACK IS APPRECIATED —NOW PAY $8’: Musk Torches AOC for Twitter Complaints https://t.co/ZvnGyvYZU6
1588199585649917955,2022-11-03 16:01:03+00:00,419,73,Most polls in the last decade have been garbage 🗑️ https://t.co/0jRMXRCnzA
1588193370614239236,2022-11-03 15:36:21+00:00,1542,153,"BIRD BATH CONTINUES! Musk to Cut 3,700 Twitter Jobs, Half the Workforce https://t.co/rvqdDexHYI"
1588183312018931713,2022-11-03 14:56:23+00:00,432,65,"GAV GETS ONE RIGHT: CA Gov. Says Dems Getting ‘Destroyed’ on Midterm Messaging, Sees Red Wave https://t.co/q3DIT3pq3x"
1588171908465709056,2022-11-03 14:11:04+00:00,600,81,"TAPPER TANKS IN PRIMETIME: CNN Host a Terrible Draw, Moved Back to Afternoon Slot https://t.co/lbss4L7aPS"
1588139323924381699,2022-11-03 12:01:35+00:00,306,90,Newly Declassified National Defense Strategy Outlines China’s Threat to American Security https://t.co/vopPQ9IoRD
1588083553769775105,2022-11-03 08:19:59+00:00,465,100,"More Questionable Assurances from Biden as Midterms Loom, Gas and Grocery Prices still Higher than Before Pandemic https://t.co/JciKPkjQWu"
1588043365978882048,2022-11-03 05:40:17+00:00,649,107,@Jim_Jordan  Warns DOJ and FBI ‘not immune from transparency or above accountability’ https://t.co/QqFdkIRO6f
1588021222645895171,2022-11-03 04:12:18+00:00,569,190,Leftwing groups tell advertisers to boycott Twitter unless Elon Musk continues censorship https://t.co/V3yltJEjHW
1587970334824751105,2022-11-03 00:50:05+00:00,592,81,"FLIPPING BLUE STATES? Washington State GOP Senate candidate Tiffany @SmileyForWA and Oregon GOP gubernatorial candidate @ChristineDrazan will join ""Hannity"" TONIGHT to discuss their campaigns. Tune in at 9 PM ET or set your DVR!"
1587967815444832261,2022-11-03 00:40:04+00:00,820,107,"DESPERATE DEMS: Midterm polls are not looking good for the Democrats, and they're playing the race card to rally their base. TONIGHT on ""Hannity,"" Senator @LindseyGrahamSC will weigh in."
1587965337202528257,2022-11-03 00:30:14+00:00,1249,154,"ECONOMIC CRISIS: President Biden has destroyed our economy, and Americans are literally paying the price. TONIGHT on ""Hannity,"" we'll get @CVPayne's analysis."
1587962788730884096,2022-11-03 00:20:06+00:00,655,73,"6 DAYS TO GO: In less than a week, voters will have the chance to put America back on the right track. TONIGHT on ""Hannity,"" @GOPLeader Rep. Kevin McCarthy, @MarkMeadows, @Reince Priebus and @LaraLeaTrump will discuss the midterms."
1587920317485154307,2022-11-02 21:31:20+00:00,452,59,GETTING ANSWERS: Watch Doocy Ask KJP If Biden Thinks GOP Voters are a Threat to Democracy https://t.co/crPYA2MKmP
1587905201188605952,2022-11-02 20:31:16+00:00,829,152,"‘FOR THE GOOD OF THE COUNTRY’: WaPo Op-Ed Asks Biden, Harris to Bow Out of 2024 https://t.co/ScHYT5HcP4"
1587896600403509248,2022-11-02 19:57:05+00:00,1492,229,"Fetterman Says Trump Tax Cuts Are To Blame for Inflation, Not Biden or Dems https://t.co/yQSCWOqhgy"
1587891042732630017,2022-11-02 19:35:00+00:00,311,77,Alaska GOP Senate candidate @KellyForAlaska sounds off on Murkowski ahead of election https://t.co/NUqZeyMtsm
1587884959922278400,2022-11-02 19:10:50+00:00,1327,155,"CRUSHING THE COMPETITION: Fox News Attracts More Viewers Than CNN, MSNBC Combined! https://t.co/bxRvm7tQIm"
1587878378861989891,2022-11-02 18:44:41+00:00,1211,261,KEEPING DEMS HONEST: The White House Deletes Social Security Tweet after It’s Flagged by Twitter https://t.co/Bjw60F95RF
1587872079784943616,2022-11-02 18:19:39+00:00,573,151,Prescription Drug Prices In 2022 Have Risen Faster Than Any Year Since Before Trump https://t.co/EA48dqKmjz
1587858602236284929,2022-11-02 17:26:06+00:00,1844,218,"AIN’T GOT THAT SWING: Florida No Longer a Swing State Thanks to DeSantis, ‘Not in Play’ For Dems https://t.co/MTcA4TPK2n"
1587847647678922753,2022-11-02 16:42:34+00:00,443,102,THE RETURN OF DARK JOE? White House Announces Biden Speech on ‘Protecting Democracy’ https://t.co/Nt8oAPukOA
1587841319489212416,2022-11-02 16:17:25+00:00,204,47,TIKTOK BARACK: Watch Obama Try to Save Democrats from Disaster —With a TikTok Collaboration https://t.co/c5CSefk9ru
1587834877998669824,2022-11-02 15:51:50+00:00,487,85,"KING OF THE HILL: Watch Joe Go Full Boomhauer, Mumble in Bizarre Southern Accent https://t.co/DDE3HPTGXd"
1587825147230265346,2022-11-02 15:13:10+00:00,1736,257,GET THE CHUCK OUT! FiveThirtyEight Election Forecaster Now Has GOP Favored to Take Senate https://t.co/qtWuP85Mhj
1587818684688498691,2022-11-02 14:47:29+00:00,131,27,"@RonDeSantisFL "" @leezeldin Will Look After the Taxpayers of New York for a Change"" https://t.co/BjRV9MT8u5"
1587812653073944577,2022-11-02 14:23:31+00:00,610,88,SPEAKER’S PET: Liz Cheney Calls Nancy Pelosi ‘Tremendous Leader of Historic Consequence’ https://t.co/8e9QMlmBrq
1587798310739496961,2022-11-02 13:26:31+00:00,703,120,Hannity: Every voter needs to do their part and 'take nothing for granted' https://t.co/Kc2aBTTz6t
1587782055764566017,2022-11-02 12:21:56+00:00,770,135,"🤦
Biden: ‘As They Say in Southern, ‘Doesn’t Know Where Y’all Been, Got Damn Boy”’ https://t.co/ZWjMQZ1VN2"
1587761891195101185,2022-11-02 11:01:48+00:00,2691,627,"Biden Claims He Spoke To Man Who ‘Invented’ Insulin, But He Died Before President Was Born https://t.co/IIu78wYMgO"
1587615571025313792,2022-11-02 01:20:23+00:00,3631,831,"Biden Claims He Spoke To Man Who ‘Invented’ Insulin, But He Died Before President Was Born https://t.co/IhFjwLJKeX"
1587607950192943106,2022-11-02 00:50:06+00:00,1396,192,"FETTERMAN FAILS: John Fetterman was clearly struggling throughout his CNN interview with Don Lemon. TONIGHT on ""Hannity,"" we'll show you the video, and @NewtGingrich will give his analysis."
1587602949580144642,2022-11-02 00:30:14+00:00,1495,201,"LYING BIDEN: President Biden is desperately trying to explain away the Democrats' failures ahead of Tuesday’s election. TONIGHT on ""Hannity,"" @SenTedCruz will weigh in."
1587597365724192769,2022-11-02 00:08:02+00:00,1129,145,"MIDTERM ELECTIONS: Republicans are gaining ground across the country. Will we see a red wave on Tuesday? TONIGHT on ""Hannity,"" we'll speak with @GovRonDeSantis, @LeeZeldin, @KellyForAlaska and @TudorDixon about their campaigns."
1587565800247988228,2022-11-01 22:02:36+00:00,286,40,TikTok Influencer faces criminal charges after posting video hitting golf ball into Grand Canyon https://t.co/ofnVGJeQCk
1587547702795149314,2022-11-01 20:50:42+00:00,965,229,CLUELESS JOE: Watch Biden Say Inflation Caused by ‘War in Iraq…Where My Son Died’ https://t.co/qjspBeWsOo
1587536269579616257,2022-11-01 20:05:16+00:00,101,32,@TheLeoTerrell New Illinois law will be 'criminal Independence Day' https://t.co/FtjIppmqBS
1587528857736941570,2022-11-01 19:35:49+00:00,553,83,"SENATE NOW A TOSS-UP: GOP Candidates Surge in the Final Week Before Midterms, Dems Panicking https://t.co/pEDrsrf82K"
1587523402218225666,2022-11-01 19:14:08+00:00,104,26,@HerschelWalker responds to Obama's 'celebrity' comments https://t.co/hht6c76FLi
1587509826900594689,2022-11-01 18:20:11+00:00,725,185,Medical Analyst Slams Fetterman Campaign For Hiding ‘Severity’ Of His ‘Significant Neurological Injury' https://t.co/gH2d8KvNSS
1587502115441844224,2022-11-01 17:49:33+00:00,1159,221,SEARS SHREDS WEINGARTEN: ‘COVID Didn’t Shut Down Schools —Politicians Did!’ https://t.co/VYWN4GTPJq
1587496103360036864,2022-11-01 17:25:39+00:00,793,129,Democrats have nothing positive to run on https://t.co/RKAjFHZXaJ
1587490969880039425,2022-11-01 17:05:16+00:00,2073,370,‘LET FAUCI OFF THE HOOK? NO WAY.’: Conservatives Pushback on Atlantic Op-Ed Demanding ‘Pandemic Amnesty’ https://t.co/c5aIFtCXN0
1587484661764313092,2022-11-01 16:40:12+00:00,2547,251,"BLOCKED! Chief Justice Roberts Hands Trump a Win, Temporarily Blocks Handover of Tax Returns https://t.co/1uk4sxcoZK"
1587478681550835714,2022-11-01 16:16:26+00:00,959,119,"SENATE RACE SHAKE-UP: Libertarian Candidate Drops Out in AZ, Backs Republican Blake Masters https://t.co/4elsNcr9Yb"
1587472725249064961,2022-11-01 15:52:46+00:00,334,45,Musk makes major changes at Twitter https://t.co/UsZ9GcRmKD
1587466982995251201,2022-11-01 15:29:57+00:00,813,99,ROGAN SEES RED: Joe Says ‘Red Wave Going to Be Like Elevator Doors Opening in The Shining’ https://t.co/fCjajsTGxU
1587461309083394048,2022-11-01 15:07:24+00:00,1713,217,ZEL BREAKS LOOSE! Zeldin Ahead of Hochul in New York According to Latest Trafalgar Poll https://t.co/fsJgcFY7kG
1587455723260329986,2022-11-01 14:45:12+00:00,1424,114,"ELON AGAIN, NATURALLY: Musk Makes Himself Twitter CEO, Dissolves Board to Become Sole Director https://t.co/JZtVcCvZCi"
1587450273315930112,2022-11-01 14:23:33+00:00,816,213,Biden Proposes Tax Increase On Oil Companies Amid Rising Energy Prices https://t.co/0tESZRpR01
1587411511961702401,2022-11-01 11:49:31+00:00,2717,1133,"IRS employees stole from COVID relief programs, went on vacations and shopping sprees https://t.co/oFx4B9l8Uk"
1587245542630981632,2022-11-01 00:50:01+00:00,655,96,"TRICK OR TREAT: ""The View"" is drawing heavy criticism for dressing children in political costumes. TONIGHT on ""Hannity,"" we'll show you the video, and @LarryElder and @KayleighMcEnany will react."
1587243054968307713,2022-11-01 00:40:08+00:00,371,59,"BARACK BACKS BARNES: During a campaign stop in Wisconsin with Democrat Mandela Barnes, Barack Obama slammed @SenRonJohnson. TONIGHT on ""Hannity,"" Senator Johnson will respond."
1587240542789836800,2022-11-01 00:30:09+00:00,668,117,"BIDEN PRAISES FETTERMAN: President Biden says radical PA Democratic Senate candidate John Fetterman is his ""kind of guy."" TONIGHT on ""Hannity,"" @DrOz will weigh in."
1587238083837173760,2022-11-01 00:20:23+00:00,1540,212,"OBAMA INSULTS WALKER: While campaigning with Warnock and Abrams in Georgia, Obama accused Republican @HerschelWalker of being a ""celebrity politician."" Walker will respond TONIGHT on ""Hannity."""
1587220766986231808,2022-10-31 23:11:34+00:00,5357,1904,"BIG TECH BOMBSHELL: Twitter, Facebook Had Regular Meetings With DHS to Discuss Censorship https://t.co/UEOR1UtkoL"
1587210509866209288,2022-10-31 22:30:49+00:00,4874,496,*PELOSI'S LAST DANCE* https://t.co/381TBF664h
1587179573418070018,2022-10-31 20:27:53+00:00,854,111,TULSI TAKES ON CHENEY! Gabbard Backs GOP Candidate Tom Barrett After Liz Cheney Backs Dem Opponent https://t.co/IK4XsX38dK
1587172258358886405,2022-10-31 19:58:49+00:00,632,74,"TRUMP ON PELOSI ATTACK: ‘A Terrible Thing,’ Liberal Lawmakers in Crime-Ridden Cities ‘Crazy’ https://t.co/iSuZdikDcs"
1587166840240881668,2022-10-31 19:37:17+00:00,1068,166,"STEEL CITY FOR OZ: Largest Pitt Paper Backs Oz for Senator, Fetterman Medical Record Dodge ‘Troubling’ https://t.co/FIlPl8qOMx"
1587158720026247168,2022-10-31 19:05:01+00:00,466,90,‘HAIL MARY DESPERATION’: Watch RNC Chair Ronna McDaniel Shred Dems for Employing Obama to Campaign https://t.co/jCQM8vEMwu
1587135971199520780,2022-10-31 17:34:37+00:00,14340,1436,"SO LONG, NANCY! CBS News Says GOP Will Take House, 8 in 10 Americans Feel America ‘Out of Control’ https://t.co/AXCEoMwd8i"
1587122587640938496,2022-10-31 16:41:26+00:00,2227,188,"WITHOUT A PARACHUTE: Musk Fired Twitter Execs ‘For Cause’ to Prevent Huge Severance Payouts, Report https://t.co/6oWNWTLsTg"
1587117013670969345,2022-10-31 16:19:17+00:00,7436,904,"HOW DO YOU LIKE IT, LIBS? Biden Inflation Tweet Flagged by Twitter Right After Elon Takes Over https://t.co/qzytg2H7Jc"
1587095767419854850,2022-10-31 14:54:52+00:00,2245,403,"DIRTY BIRD: After Twitter Takeover, Elon Shares ‘Evidence of Fraudulent Metrics’ https://t.co/GnO9on2SfD"
1587089599322636288,2022-10-31 14:30:21+00:00,1645,181,"THANKS LIZ! Kari Lake Writes EPIC ‘Thank You’ Note to Liz Cheney, ‘Enjoy Your Forced Retirement’ https://t.co/JBZ5HOLgAk"
1587084175345156101,2022-10-31 14:08:48+00:00,502,114,BACKWARDS BIDEN: Adimin Accuses AZ of Trespassing for Filling Border Gaps With Shipping Containers https://t.co/ieEZuolbYY
1586793098856005632,2022-10-30 18:52:10+00:00,431,103,Mortgage rates soar to highest in 20 years https://t.co/GCvbHpuwiC
1586741460774305792,2022-10-30 15:26:59+00:00,389,54,Kamala Harris: “I Love Venn Diagrams” https://t.co/BTMpztDnkM
1586546581171568643,2022-10-30 02:32:36+00:00,850,87,@RonDeSantisFL Predicts Republicans Will Win Governorship In New York https://t.co/IYHQUzeWRO
1586470915679916032,2022-10-29 21:31:56+00:00,913,192,Gisele Fetterman Says ‘Swimming In America Is Very Racist’ https://t.co/tT2nYGyOPO
1586444782741618690,2022-10-29 19:48:05+00:00,1103,152,Oz Camp Circles Biden’s Fetterman Fundraiser with Mobile Billboard Playing Candidate Debate on Loop https://t.co/6UBailWUql
1586418990326419457,2022-10-29 18:05:36+00:00,1305,207,The Biden White House has mangled one crisis after another https://t.co/IYRmtkVgMe
1586369826800521216,2022-10-29 14:50:14+00:00,498,196,Filed court docs show tens of thousands of migrants cases simply ‘thrown out’ https://t.co/nx96UDBR3c
1586307620033495040,2022-10-29 10:43:03+00:00,1618,220,"It’s not the secret garden, Joe —it’s your White House garden! https://t.co/dR0KxcNqSc"
1586227251049267201,2022-10-29 05:23:41+00:00,6106,1066,"Biden Says Gas Prices Were ‘Over Five Dollars’ When He Took Office, It Was Actually $2.39 https://t.co/uTy80ioo8e"
1586158399242346498,2022-10-29 00:50:06+00:00,810,102,"DEMOCRATS IGNORING VOTERS: The Democrats are pushing their woke agenda while their constituents are worried about putting food on the table. TONIGHT on ""Hannity,"" we'll show you what one Pennsylvania voter told Jen Psaki, and @HeyTammyBruce and @AriFleischer will weigh in."
1586155878109126656,2022-10-29 00:40:05+00:00,1118,173,"OBAMA ON THE ROAD: Barack Obama is campaigning with Senator Raphael Warnock and Stacey Abrams. Does this mean he supports their radical positions? TONIGHT on ""Hannity,"" we'll discuss with @SenTedCruz."
1586153362772353024,2022-10-29 00:30:05+00:00,617,83,"BUDD GAINS GROUND: North Carolina GOP Senate candidate @TedBuddNC is leading his Democratic opponent. TONIGHT on ""Hannity,"" we'll speak with Rep. Budd and Sen. @LindseyGrahamSC about the race."
1586150845187506186,2022-10-29 00:20:05+00:00,1145,249,"HE SAID WHAT? Ohio Democratic Senate candidate Tim Ryan's promise to free nonviolent criminals has resurfaced, and voters are not happy. TONIGHT on ""Hannity,"" Ryan's opponent @JDVance1 will join us."
1586148323421032449,2022-10-29 00:10:04+00:00,720,67,"11 DAYS TO GO: The midterm elections are just 11 days away, and TONIGHT we will tell you what's at stake. @BillHemmer, @RobertCahaly and @MattTowery will join ""Hannity"" TONIGHT with the latest polling."
1586134619375783936,2022-10-28 23:15:36+00:00,214,28,THE BOULDER CREST FOUNDATION: A Non-Profit for Veterans and First Responders https://t.co/AxAzArLoRh
1586126668606984193,2022-10-28 22:44:01+00:00,1071,276,"Grassley, Johnson Share Hunter Biden China Bank Records https://t.co/OGYGlw4VR9"
1586084947386945536,2022-10-28 19:58:14+00:00,296,50,Charlie Crist is excited to be a rubber stamp for Biden https://t.co/EK4G5bk1xs
1586078282067353607,2022-10-28 19:31:45+00:00,460,63,GOODNESS GRACIOUS: Rock Legend and ‘Great Balls of Fire’ Singer Jerry Lee Lewis Dead at 87 https://t.co/ivyLkPCkaU
1586072548038660098,2022-10-28 19:08:57+00:00,2086,215,‘IN SANE HANDS’: Trump Happy Twitter ‘No Longer Run by Radical Left Lunatics’ https://t.co/ZaovgP5sX6
1586066618261585923,2022-10-28 18:45:24+00:00,888,91,"‘WHERE’S NANCY?’: Hammer-wielding Pelosi Intruder Identified, Was Looking for Nancy?! https://t.co/26fuXrMhBk"
1586059370873475073,2022-10-28 18:16:36+00:00,1582,250,"A PEEK INSIDE THE CAGE: Musk Hands Twitter Code to Tesla Engineers for Review, Locks Out Twitter Employees https://t.co/FdYnJx3lpw"
1586041628803977217,2022-10-28 17:06:06+00:00,178,41,"MEANWHILE, ON THE LEFT: Watch Lawrence O’Donnell Compare John Fetterman to FDR https://t.co/u482vmUiPk"
1586034446154752000,2022-10-28 16:37:33+00:00,161,30,THE END OF THE BRADY BÜNDCH: Gisele Bündchen Files for Divorce https://t.co/AwWH5T1rDj
1586028548149624835,2022-10-28 16:14:07+00:00,471,90,"SAD MONEY: Jim Cramer in Tears After Meta Stock Nosedives, ‘I Made a Mistake’ https://t.co/aRLLOHmXKc"
1586023442238808064,2022-10-28 15:53:50+00:00,1288,203,"BAD LUCK, CHUCK! Listen to Schumer Caught on Hot Mic Telling Biden ‘We’re in Danger’ https://t.co/RgQsk2txuO"
1586017935222530048,2022-10-28 15:31:57+00:00,8312,630,"WELCOME BACK TWEETER: Musk to End Lifetime Twitter Bans, Report https://t.co/bI3Macx9fa"
1586010991837548545,2022-10-28 15:04:21+00:00,404,73,"In Syracuse, NY Biden Whispers in Strange Creepy Voice Again https://t.co/mv0dXrps8m"
1586005264137854982,2022-10-28 14:41:36+00:00,1382,236,‘GAS’LIGHTING: Biden Claims Gas Was More Than $5 a Gallon When He Took Office https://t.co/froSQddmUe
1585998855300063233,2022-10-28 14:16:08+00:00,3541,359,"‘THE BIRD IS FREED’: Musk Officially Takes Over Twitter, Fires Top Execs —Includes Hunter Biden Censor https://t.co/H2DZuqDVof"
1585993313101963267,2022-10-28 13:54:06+00:00,1193,98,BREAKING: Speaker’s Husband Paul Pelosi Attacked at Couple’s San Fran Home https://t.co/9BM4A2itm4
1585978909417476099,2022-10-28 12:56:52+00:00,161,21,@RonDeSantisFL These differences are about what it means to be an American https://t.co/BNolbtofDW
1585912979131973636,2022-10-28 08:34:53+00:00,591,114,Jersey senator under investigation AGAIN... https://t.co/gQ4CcMtHPm
1585809592738537472,2022-10-28 01:44:04+00:00,634,52,STAY TUNED: Senator @MarcoRubio and @SenRickScott will discuss the midterm elections. Will Republicans take the House and the Senate? Stay tuned!
1585803793681219585,2022-10-28 01:21:01+00:00,848,70,UP NEXT: Senator @MarcoRubio will join @GovRonDeSantis as our town hall continues!
1585796007807385602,2022-10-28 00:50:05+00:00,405,43,"10 MINUTES AWAY: Our ""Hannity"" town hall with @GovRonDeSantis, Senator @MarcoRubio and @SenRickScott will start in just 10 minutes! Don't forget to tune in or set your DVR!"
1585793490109210624,2022-10-28 00:40:05+00:00,257,31,"VETTING VAL: TONIGHT on ""Hannity,"" we'll tell you everything you need to know about FL Democrat Senate candidate Val Demings. We'll also speak with Senator @MarcoRubio about his re-election campaign."
1585791006498226176,2022-10-28 00:30:13+00:00,1067,107,"DESANTIS CRUSHES CRIST: @GovRonDeSantis dominated in his debate against Democratic challenger Charlie Crist. Tune into ""Hannity"" TONIGHT to see the highlights!"
1585788466717233156,2022-10-28 00:20:07+00:00,409,50,"HANNITY IN FLORIDA: TONIGHT, we're hosting a town hall in West Palm Beach, Florida with @GovRonDeSantis, Senator @MarcoRubio and @SenRickScott. Tune in at 9 PM ET or set your DVR!"
1585760015331348480,2022-10-27 22:27:04+00:00,875,105,John Fetterman should not be running for Senate https://t.co/oDZGFBcGC8
1585754816604786688,2022-10-27 22:06:24+00:00,541,88,PANIC AT THE LINGO: Democrats in Full-On Panic After Fetterman’s Speech Troubles at Debate https://t.co/aDX5YolSJB
1585748673912344578,2022-10-27 21:42:00+00:00,486,63,HANNITY EXCLUSIVE: Insider Advantage Survey Shows Oz Up on Fetterman After Dem’s Disastrous Debate https://t.co/ULRe8xsM6A
1585743600046014469,2022-10-27 21:21:50+00:00,34,9,@DrOz warns Fetterman's radical leftism was exposed in Harrisburg debate https://t.co/eITp1umheZ
1585737485736214528,2022-10-27 20:57:32+00:00,768,130,John Fetterman should be forced to resign @KellyannePolls https://t.co/adzcQp5iWv
1585731537055653888,2022-10-27 20:33:54+00:00,575,106,Kamala: Gas Powered School Buses Contribute ‘to Very Serious Conditions’ that Affect Children’s ‘Ability to Learn’ https://t.co/zKaO41mb2S
1585726303696740352,2022-10-27 20:13:06+00:00,1057,134,"GREG GOES BIG: Gutfeld! Hits 2.5 Million Viewers, Biggest Night in Show’s History https://t.co/ciVHwfzZfM"
1585721121479049217,2022-10-27 19:52:31+00:00,375,84,"NOT THE SHARPEST KNIFE: Hochul Thought Hacked New York Post Stories Were Real, ‘We Demand Answers’ https://t.co/c8FJDAKOYK"
1585715366189273094,2022-10-27 19:29:39+00:00,339,75,"Fetterman Campaign Blames Captioning System For His Incoherent Performance, Company Responds https://t.co/84EentsHVe"
