id,created_at,favorite_count,retweet_count,text
1610959676048285697,2023-01-05 11:21:31+00:00,489,119,500 migrants find their way to Florida Keys shore forcing major park to close https://t.co/B6HubszZYf
1610891776847486976,2023-01-05 06:51:43+00:00,675,101,"Nearly Two Years Into Worsening Border Crisis, Biden Finally Planning His First Trip To Border https://t.co/ZGJn1sC7vr"
1610877374438019072,2023-01-05 05:54:29+00:00,229,34,What Bibi’s New Government Means for US-Israel Relations https://t.co/WffZiuasxU
1610836802155286528,2023-01-05 03:13:16+00:00,2417,228,Twitter erupts after Lauren Boebert calls out Trump during House Speaker vote https://t.co/tIQv4d1Nir
1610829616918167552,2023-01-05 02:44:43+00:00,1741,214,Biden Gets Defensive When Asked Why He Wasn’t Invited To Pope Benedict’s Funeral: ‘You Know Why’ https://t.co/9T36hkHbwr
1610815861178220544,2023-01-05 01:50:03+00:00,552,64,"VOTING WITH THEIR FEET: Instead of staying in dysfunctional blue states, Americans are moving to Florida and Texas. TONIGHT on ""Hannity,"" we'll break down the numbers and get reaction from @Karol Markowicz and @LarryElder."
1610813351046553600,2023-01-05 01:40:05+00:00,1157,211,"SCHIFF SHOW: The latest batch of Twitter Files reveal that Adam Schiff's office asked the platform to suspend multiple accounts! TONIGHT on ""Hannity,"" @DevinNunes and @PamBondi will react."
1610810864038285318,2023-01-05 01:30:12+00:00,199,41,"AOC'S BIG IDEA: Squad member AOC suggested the House form a ""coalition government"" as the members struggle to elect a speaker. TONIGHT on ""Hannity,"" @GovMikeHuckabee and @JasonInTheHouse will discuss."
1610808321115668487,2023-01-05 01:20:05+00:00,201,30,"THE SAGA CONTINUES: @ChadPergram will join ""Hannity"" TONIGHT with the latest on the ongoing battle for speaker of the House. We'll also speak with Rep.-elect @LaurenBoebert and @TGowdySC."
1610784337657479171,2023-01-04 23:44:47+00:00,2591,549,PIECE OF SCHIFF: Adam Schiff’s Office Requested Journos Be Suspended from Twitter https://t.co/Dh6y3F52fe
1610777236721778692,2023-01-04 23:16:34+00:00,145,21,Parents of slain Idaho student react to arrest of Bryan Kohberger https://t.co/0F3BhxWJAj
1610771379715981312,2023-01-04 22:53:18+00:00,107,22,@newtgingrich A number of 'so-called insurgents' are putting 'their re-election at risk' over the House speaker vote https://t.co/aQfOH2yB8x
1610757086123593753,2023-01-04 21:56:30+00:00,2,1,"@JessicaTarlov joins the 'Hannity Hot Seat' and reacts to McCarthy's speakership bid and President Biden's tax hikes heading into the new year
 https://t.co/sM3KJbAPn7"
1610741181792518164,2023-01-04 20:53:18+00:00,2452,246,"BURNING DOWN THE HOUSE: McCarthy Handed Fifth Loss in Speaker Bid, Freedom Caucus Won’t Budge https://t.co/MVzudSDFgY"
1610732841611952146,2023-01-04 20:20:10+00:00,369,43,PLAYING WITH FIRE: Watch Arsonists in California Light Themselves on Fire While Attacking Business https://t.co/vR3mqmWNFu
1610724279309504516,2023-01-04 19:46:08+00:00,505,68,"‘NOT MY PROBLEM’: Biden Says Speaker Fight ‘Embarrassing,’ ‘Not a Good Look’ https://t.co/LBnazm4ttP"
1610717441998430208,2023-01-04 19:18:58+00:00,983,81,GAVEL GRIND: McCarthy Fails to Reach Required Speaker Votes for Fourth Time https://t.co/HohSFtCWy6
1610707397605048331,2023-01-04 18:39:03+00:00,463,61,Kevin McCarthy: ‘I Am Not Going Anywhere’ https://t.co/htoQH0pUYV
1610701038549336064,2023-01-04 18:13:47+00:00,599,49,GOD ON THE GRIDIRON: ESPN Analyst Prays for Injured Bills Safety Damar Hamlin During Live Broadcast https://t.co/sux2S87D3I
1610695102338416672,2023-01-04 17:50:12+00:00,1229,179,LATE POPE TO DOPE: Don’t Come to My Funeral! https://t.co/zBakbYH4pc
1610687515219955719,2023-01-04 17:20:03+00:00,872,96,"HALEY’S COMMENT: ‘Nothing to Celebrate About Woke, Bloated Infrastructure Law Full of Waste’ https://t.co/FENYznX27I"
1610680859794853888,2023-01-04 16:53:36+00:00,1003,191,NO VACANCY! NYC Mayor Eric Adams Says Big Apple Can’t Take Migrants from Colorado https://t.co/44oOHVDGrv
1610671023082315778,2023-01-04 16:14:31+00:00,167,24,"CHAMBER CHAT: AOC Speaks With GOP Rep. Paul Gosar on House Floor, Twitter Freaks Out https://t.co/RMHMAZajTB"
1610664470388277254,2023-01-04 15:48:29+00:00,2618,304,"‘VOTE FOR KEVIN, CLOSE THE DEAL’: Trump Shares Message for House GOP https://t.co/71gBaoeyvt"
1610646654910169090,2023-01-04 14:37:41+00:00,192,22,Sean breaks down the GOP's speakership battle https://t.co/Gz7bqq9Euh
1610512726077349889,2023-01-04 05:45:30+00:00,956,111,White House Press Sec Claims Biden Admin Has ‘Made Significant Significant Progress’ In Lowering Gas Prices https://t.co/fowCAgEIiz
1610453486273003521,2023-01-04 01:50:06+00:00,835,66,"PRAY FOR DAMAR: Buffalo Bills safety Damar Hamlin remains in critical condition after collapsing during last night's game. TONIGHT on ""Hannity,"" @StephenASmith will discuss."
1610450969342484480,2023-01-04 01:40:06+00:00,317,32,"ALLEGED IDAHO KILLER: Bryan Kohberger, who is accused of murdering four University of Idaho students, appeared in a Pennsylvania courtroom today. The parents of Kaylee Goncalves, one of Kohberger's alleged victims, will join ""Hannity"" TONIGHT."
1610448459395391488,2023-01-04 01:30:08+00:00,1839,393,"DOJ BIAS: The DOJ is allegedly hiding 400 pages of documents that detail gifts Hunter and Jim Biden received from Russia, China and Ukraine. TONIGHT on ""Hannity,"" attorney Kevin Evans and @RepJamesComer will discuss."
1610445928149696513,2023-01-04 01:20:04+00:00,215,19,HANNITY HOT SEAT RETURNS: @JessicaTarlov and Sean will debate the news of the day. Don't forget to tune in at 9 PM ET or set your DVR!
1610443424737509378,2023-01-04 01:10:07+00:00,434,47,"HOUSE REPUBLICANS DIVIDED: After three rounds of voting, the House failed to elect a new speaker today. @ChadPergram will join ""Hannity,"" TONIGHT with a full report, and @NewtGingrich will weigh in."
1610431226204020737,2023-01-04 00:21:39+00:00,323,84,Report: 100 Million American residents will be on Medicaid in ‘next 72 days’ https://t.co/AbS29Nt82U
1610393002186362880,2023-01-03 21:49:46+00:00,1474,186,"OUT OF THE PICTURE: Kamala Requiring COVID Tests for Swearing-In Photos, One Senator Says ‘No Thanks’ https://t.co/cCS8LCfLCk"
1610382699339948033,2023-01-03 21:08:49+00:00,374,102,ICE Deportations Remain At Historic Low Despite Illegal Immigration At Record High https://t.co/gErFobUwKK
1610372164867264522,2023-01-03 20:26:58+00:00,798,83,"SPEAKER SPAT! McCarthy Fails to Convince Holdouts, Vote Goes to Second Ballot for First Time in 100 Years https://t.co/XC3iknw7bg"
1610358461086277633,2023-01-03 19:32:30+00:00,2128,151,"RON’S ROUND 2: DeSantis Sworn In for Second Term, Uses Historic ‘Bible of the Revolution’ https://t.co/cI48AKD9uQ"
1610353007195045888,2023-01-03 19:10:50+00:00,615,76,Illinois Supreme Court halts elimination of cash-bail day before taking effect https://t.co/33Gl6Yv0x2
1610346814410039298,2023-01-03 18:46:14+00:00,104,20,"@NewtGingrich Shreds the Never-McCarthy House Republicans: ""They’ve Got a ‘Psychological Problem"" https://t.co/6sGrWqU2jl"
1610341740677824514,2023-01-03 18:26:04+00:00,146,29,TV Reporter Records Russian Missile Strike at Ukraine Arena While Making a Live Report https://t.co/sCAqkKVvEG
1610329849733828610,2023-01-03 17:38:49+00:00,595,107,"WORST IN THE NATION: Some New York Cities Rank Worst for Poverty, Homelessness https://t.co/ZQFI5dHgI9"
1610324277491863553,2023-01-03 17:16:40+00:00,3940,435,IMPEACH! GOP Rep. Set to File Impeachment Articles Against Mayorkas as Soon as New Congress Sworn In https://t.co/0fiqYtYdAY
1610319135963062273,2023-01-03 16:56:14+00:00,7211,2204,"HOLIDAY JOE: President Biden Spent 146 Days on Vacation in 2022, 40% of the Year https://t.co/AcN8ZMIXzx"
1610312582056787970,2023-01-03 16:30:12+00:00,593,56,"LAST WORDS: Bedside Nurse Reveals Pope Benedict XVI’s Final Words, ‘Lord, I Love You’ https://t.co/FrtFQeNBGm"
1610304198247063554,2023-01-03 15:56:53+00:00,5165,735,‘THIS IS ON PURPOSE’: Gov. Kristi Noem Blasts Biden for ‘Destroying Our Border’ to ‘Remake America’ https://t.co/phBOV8IZ9m
1610298161402191877,2023-01-03 15:32:54+00:00,1504,107,‘PLEASE CONTINUE TO PRAY’: Bills’ Damar Hamlin Still in Critical Condition After MNF Collapse https://t.co/UpiSXwtrQg
1610115995087110149,2023-01-03 03:29:02+00:00,749,169,ICE Deportations Remain At Historic Low Despite Illegal Immigration At Record High https://t.co/R9iD9wD0Ps
1609991510111535106,2023-01-02 19:14:22+00:00,6703,1662,Biden Wrong Again: Tax hikes from Inflation Reduction Act will hit families making less than $400k/year https://t.co/vMpGOkT0VV
1609934330062684160,2023-01-02 15:27:10+00:00,1061,388,Biden administration ‘reopens’ legal path to citizenship for taxpayer-funded welfare recipients https://t.co/vhj2Npzf7o
1609683872752574466,2023-01-01 22:51:56+00:00,4673,877,Buttigieg Warned Before Holidays By Own Party Of Looming Airlines Crisis https://t.co/sKwZvscnJb
1609584850549235714,2023-01-01 16:18:27+00:00,61,13,@RealBenCarson on what Americans can learn from COVID policy failures https://t.co/2QEOQszjm8
1609458914680078337,2023-01-01 07:58:02+00:00,155,20,@JoeConchaTV Always judge Joe Biden by his actions not by his words https://t.co/gW6axb3XZM
1609295029138296841,2022-12-31 21:06:48+00:00,2131,520,Welfare Programs In Many States Pay More Than Most Jobs https://t.co/GPZOSGo7jf
1609240825447284736,2022-12-31 17:31:25+00:00,5144,1062,Elon Musk Reveals Ex-Twitter Employees Ran ‘Fauci Fan Club’ Slack Channel https://t.co/GAIVqPsw1S
1609232190226710529,2022-12-31 16:57:06+00:00,13,2,@NancyGrace on the arrested Idaho murder suspect: His words would suggest an accomplice https://t.co/TMmMBhPZTH
1609226214933254146,2022-12-31 16:33:22+00:00,800,80,Police have a 'great deal' of evidence against Idaho murders suspect: Ted Williams https://t.co/sVgKM7DyMw
1609193282348748801,2022-12-31 14:22:30+00:00,665,78,"Barbara Walters, trailblazing broadcaster, dead at 93 https://t.co/1kOHhPkQfJ"
1608945779758059520,2022-12-30 21:59:01+00:00,105,24,@greggjarrett Blame Twitter For The “Fauci Fan Club” That Only Emboldened A Meglomaniac https://t.co/UNGAnUM1Ag
1608938383891480577,2022-12-30 21:29:38+00:00,185,32,@GovMikeHuckabee slams Biden's U.S. Virgin Islands vacation https://t.co/OD7vNI4dvZ
1608932558573654016,2022-12-30 21:06:29+00:00,154,26,@TomiLahren calls for a 'reckoning' after Twitter's dangerous censorship push https://t.co/psRjQbfHZ9
1608917393685757955,2022-12-30 20:06:13+00:00,427,104,"@newtgingrich This is the most corrupt, dangerous executive branch in US history https://t.co/WXMkJJfcza"
1608873502374764549,2022-12-30 17:11:49+00:00,299,53,White House delays GOP oversight requests @ChadPergram https://t.co/kwcJ7jJGC1
1608867874780680193,2022-12-30 16:49:27+00:00,626,98,"THIS IS REAL: Time Magazine Publishes Article on Exercise Being Racist, Gets Rightfully Roasted https://t.co/kf3Bl5DuxG"
1608861840741732352,2022-12-30 16:25:28+00:00,3960,447,JOE’S DIVE! New Poll Shows More Americans Believe U.S. Getting Weaker on World Stage https://t.co/6CykA3NeHQ
1608855578964623367,2022-12-30 16:00:35+00:00,3213,334,MAHER SAYS: ‘The Woke Left Pisses Me Off So Much’ https://t.co/wMpSI6jN2n
1608841845194227712,2022-12-30 15:06:01+00:00,400,87,"FREEFALL! Stocks Set For Worst Year Since 2008, All Major Averages Down https://t.co/19Nr1ttfLa"
1608700553026060290,2022-12-30 05:44:34+00:00,977,219,"Chinese Military Jet Comes Within 10 Feet Of U.S. Plane, Forces Evasive Maneuvers https://t.co/AalPctJ2uJ"
1608607750484893697,2022-12-29 23:35:48+00:00,3441,289,Texas Placing Shipping Containers Along El Paso Sector Of Southern Border https://t.co/XONt7QuFKE
1608590340679733248,2022-12-29 22:26:38+00:00,670,104,This will come back to haunt these people politically @CharlesHurt https://t.co/cqE3SPzpgj
1608581178524667905,2022-12-29 21:50:13+00:00,590,66,"Beth Van Duyne, Nancy Mace rip Buttigieg, federal response to airline crisis https://t.co/5s7F3h8sbX"
1608565812054343680,2022-12-29 20:49:09+00:00,562,120,FAUCI FAN CLUB?! Ex-Twitter Employees Had Pro-Fauci Slack Channel https://t.co/9zcuWRNJAD
1608559306298871816,2022-12-29 20:23:18+00:00,225,47,ADAMS’ APPLE: NYC Mayor Says ‘Big Brother is Protecting You’ https://t.co/HZjJtjgahw
1608552929195081729,2022-12-29 19:57:58+00:00,3033,340,WE COULDN’T STAND HIM FOR 8! Michelle Obama Says She ‘Couldn’t Stand Husband for 10 Years’ https://t.co/HrlqzBXFRb
1608523218955997184,2022-12-29 17:59:54+00:00,1950,419,BORDER BULL! Watch Biden Admin Lie Over and Over About a ‘Secure’ Border https://t.co/tbWUznVLp8
1608517947160395776,2022-12-29 17:38:58+00:00,5266,585,‘THUGS’ WITHDRAW SUBPOENA: Trump Blasts ‘Unselect Committee’ After It Drops Don Subpoena https://t.co/mKBmp9Po14
1608511894368698370,2022-12-29 17:14:54+00:00,1714,144,"BIBI BACK ON TOP: Netanyahu Returns to Power, Israel’s New Government Sworn In https://t.co/PGoOnklcUQ"
1608506688125952001,2022-12-29 16:54:13+00:00,28893,5627,"SO, NOT RACIST? Biden Issues COVID Testing for China Travelers, Called Trump ‘Xenophobic’ for Same Move https://t.co/3cq5wJvILn"
1608501281399652352,2022-12-29 16:32:44+00:00,2385,309,"TEXAS TOUGH: Abbott Hits Back After Biden Admin Criticizes Busing, ‘Hypocrite-in-Chief’ https://t.co/D2fv6MKXwM"
1608485956545290240,2022-12-29 15:31:50+00:00,516,78,TRAGIC KINGDOM: Spike in Fights at Disney Parks Prompts Updated Behavior Warnings https://t.co/sFbSFHIO23
1608478321158782978,2022-12-29 15:01:30+00:00,9699,1157,"NOT A SCIENTIST! Musk Torches Fauci, ‘Cannot Be Regarded as a Scientist’ https://t.co/BM2CExeLsj"
1608216774377455617,2022-12-28 21:42:12+00:00,798,178,Joe Biden wants a wide open border in the US: @RepDonaldsPress https://t.co/Wl8MDno3sW
1608187462194548737,2022-12-28 19:45:44+00:00,1376,239,‘Twitter Files’ Put FBI Failures In Full Focus @greggjarrett @PamBondi https://t.co/7OdmSK8Ad2
1607863406744276992,2022-12-27 22:18:03+00:00,1247,119,SAFE HOUSE: TikTok to Be Removed ‘from all House Managed Devices’ https://t.co/Vj4apjKrI9
1607857134082969600,2022-12-27 21:53:07+00:00,1328,197,TOTAL SCHIFF SHOW! Rep. Adam Schiff Getting ‘Serious’ About Senate Run https://t.co/Gzel8F8GET
1607785485841174534,2022-12-27 17:08:25+00:00,1987,252,"TRUMP UNLOADS ON ‘OLD CROW’: ‘Another Win for Dems, Mitch! Wouldn’t Have Happened Under Trump!’ https://t.co/yRiBMQZO7Y"
1607779381098807297,2022-12-27 16:44:10+00:00,1068,296,"BIDEN’S BORDER: 233,740 Migrant Encounters Logged in November, Largest Ever Recorded https://t.co/28QADPKsi3"
1607774043565969411,2022-12-27 16:22:57+00:00,8042,913,GAETZ SHARES CHRISTMAS WISH: ‘Jim Jordan Should be Speaker of the House’ https://t.co/2Q2x5Au7Va
1607768047686647810,2022-12-27 15:59:08+00:00,11307,1277,‘WTF IS SHWANZA?!’ Pelosi Wishes Everyone ‘Happy Shwanza’ in Last Speech as Speaker https://t.co/gOTQPdEfmT
1607748956728983552,2022-12-27 14:43:16+00:00,7417,542,"MERRY CHRISTMAS, KAMALA!: ICYMI Watch Busloads of Migrants Dropped Off at Kamala’s D.C. Residence https://t.co/DToVvjAMjQ"
1606395136883265536,2022-12-23 21:03:40+00:00,1457,307,McConnell Claims Republicans ‘Number One Priority’ Is Providing Aid To Ukraine https://t.co/A8YlobWl05
1606336544255741952,2022-12-23 17:10:51+00:00,4566,1115,"WON’T SAY JESUS: Watch Biden Give Christmas Remarks, Bend Over Backwards to Avoid ‘Jesus’ https://t.co/3XwPKskVQg"
1606326429838344192,2022-12-23 16:30:39+00:00,619,67,"CAUGHT ON CAMERA: Bizarre Hostage Situation in Mississippi Walmart, Suspect Shot and Killed https://t.co/b45T4gYFPt"
1606320022518996995,2022-12-23 16:05:12+00:00,14897,2075,"‘RAND’PAGE! Paul Pissed Spending Bill Passed, Blasts Congress, ‘We the People Demand Accountability!’ https://t.co/XKvLKoHnKO"
1606314477485539328,2022-12-23 15:43:09+00:00,3716,457,"GETTING ANSWERS: FLA Supreme Court Approves DeSantis’ Request, Vax Investigation Moves Forward https://t.co/KK735uunzN"
1606309094029246469,2022-12-23 15:21:46+00:00,728,78,"COLD SNAP! Sports Reporter in for Weatherman Goes Viral, ‘Can I Go Back to My Regular Job?’ https://t.co/V2VMj1k7Ae"
1606300174657245184,2022-12-23 14:46:19+00:00,756,189,Latino caucus in California accused of banning Hispanic Republicans https://t.co/J6TZ71sSlL
1606217717576499203,2022-12-23 09:18:40+00:00,1735,247,AOC Fact-Checked For Tweet Attacking Republicans On Minimum Wage https://t.co/n6C2XSOrtX
1606137891494809601,2022-12-23 04:01:28+00:00,741,189,Taliban slips back into former tyranny with first public execution since Afghanistan takeover https://t.co/1pWVnNM1JN
1606082007758503941,2022-12-23 00:19:24+00:00,488,118,Study: Harmful content pushed to users on TikTok every 39 seconds https://t.co/yraVm5kB0V
1606049390459867137,2022-12-22 22:09:48+00:00,897,207,"WOKE WITHIN THE RANKS: $2M Study Recommends Military Stop Using ‘Sir,’ ‘Ma’am’ https://t.co/MQkrC3HGSf"
1606043146487472150,2022-12-22 21:44:59+00:00,797,174,"This is an unmitigated, legislative atrocity @StephenM https://t.co/5NpnGL2Ihq"
1606035453781676033,2022-12-22 21:14:25+00:00,491,108,"‘WE HAVE AN AGREEMENT’: $1.7 Trillion Dollar Spending Bill Clears Senate, Advances to House https://t.co/PzlASSrjYI"
1606029375157182464,2022-12-22 20:50:16+00:00,2217,310,I think the country sees this committee for what it is @Jim_Jordan https://t.co/XxxDWkOiSG
1606004460488204289,2022-12-22 19:11:16+00:00,4627,651,"‘VOTE NO!’: Trump Unloads on ‘Unacceptable’ Spending Bill, ‘Crammed With Left-Wing Disasters’ https://t.co/lprsSHYKdD"
1605995179684544513,2022-12-22 18:34:23+00:00,214,45,IT’S GOING TO BE A COVID CHRISTMAS! Canadian Health Officer Does COVID PSA with Mrs. Claus https://t.co/bPCYjq5Cr8
1605988616743829529,2022-12-22 18:08:18+00:00,1270,280,RAND’S REMIX: Paul Performs Hilarious Spending Bill Version of ‘Twas the Night Before Christmas’ https://t.co/rD8VDKPCQO
1605972675809185795,2022-12-22 17:04:58+00:00,15226,2997,"YOU COULD HAVE PREVENTED IT, NANCY! House GOP Report Torpedoes Pelosi’s Jan. 6 Narrative https://t.co/MiR12TQN7E"
1605967518115536899,2022-12-22 16:44:28+00:00,1498,210,"ENOUGH! Speaker Seeker Biggs Blasts Blank Check to Ukraine, ‘Enough With All This!’ https://t.co/fgcK7qnbtO"
1605962318231339008,2022-12-22 16:23:48+00:00,231,40,"HOLIDAY HAVOC! ‘Bomb Cyclone’ Cancels Thousands of Flights, Americans Prepare for Sub-Zero Temps https://t.co/hGPpKtDVxl"
1605952508916125698,2022-12-22 15:44:49+00:00,3810,615,"Watch Rand Paul Torch Omnibus Spending Bill, 'It's an Abomination!' https://t.co/KAdiA1HHvz"
1605945047341563908,2022-12-22 15:15:10+00:00,817,129,G-MEN RESPOND: ‘Unfortunate that Conspiracy Theorists are Feeding the American Public Misinformation’ https://t.co/tGMlVI72ZR
1605935473880449025,2022-12-22 14:37:08+00:00,4068,364,DISNEY IN THE DUMPS! House of Mouse Looking at Worst Year Since 1974 https://t.co/3Rxxrhmkqi
1605759435036626945,2022-12-22 02:57:37+00:00,714,105,White House woes: New book details ‘tension’ between Biden and Harris https://t.co/Vb4bVE0fIO
1605739711401758720,2022-12-22 01:39:15+00:00,4536,735,"RAND SLAM: Watch Rand Paul Torch Omnibus Spending Bill, ‘It’s an Abomination!’ https://t.co/H6Hyj1fK2A"
1605709588061474816,2022-12-21 23:39:33+00:00,240,37,MUST WATCH https://t.co/eQ2jqUMpbZ
1605696550742753282,2022-12-21 22:47:44+00:00,5070,1548,The FBI Was Paying Twitter $3.4 Million ‘to Help Censor Americans’ @MirandaDevine https://t.co/Ddyzs8SCXj
1605690213900206081,2022-12-21 22:22:33+00:00,560,123,@MarshaBlackburn The Biden administration has shown disrespect and disregard for the states https://t.co/9INfXkRT9Y
1605683743175458817,2022-12-21 21:56:51+00:00,1718,217,Kamala Harris has very little credibility in almost anything @KellyannePolls https://t.co/2aXFgpKpbt
1605678268908199937,2022-12-21 21:35:06+00:00,208,76,@saracarterdc joins Texas DPS for exclusive look at border crisis https://t.co/onKQcz5eCa
1605667413533548551,2022-12-21 20:51:57+00:00,443,74,THE GREAT DEPRESSION: New Poll Shows Americans’ Mental Health Hits New Low https://t.co/scVvjH52sv
1605661144798167040,2022-12-21 20:27:03+00:00,268,42,"WATCH: Zelenskyy Arrives in Washington D.C., Will Address Congress in Bid for More Support https://t.co/r5tba95pfQ"
1605635791169912838,2022-12-21 18:46:18+00:00,689,135,Latest “Twitter Files” Show How FBI Influenced Social Media To Censor Biden Laptop Story https://t.co/zXzIBdFr8W
1605630639318892566,2022-12-21 18:25:50+00:00,498,88,Dem Agenda Increasingly Hostile to 2nd Amendment https://t.co/3yLVA58yz8
1605624701757390848,2022-12-21 18:02:14+00:00,1938,252,"‘NO MORE BAD DEALS!’ FLA Rep. Donalds Blasts Spending Bill, ‘Every Republican Should Be a No’ https://t.co/xIj70VMtx2"
1605618535442554881,2022-12-21 17:37:44+00:00,586,143,"MSNBC CATCHES UP! Contrary to KJP Comments, Reporter Says Illegal Migrants ‘Walked Right In’ https://t.co/Stz04kfUDw"
1605612171219673089,2022-12-21 17:12:27+00:00,5842,762,"‘A BIG SERVICE’: Trump Praises Elon Musk for Releasing Twitter Files, Exposing Corruption https://t.co/8EjyFwuu2Z"
1605605333769936898,2022-12-21 16:45:16+00:00,6234,940,"COMER: ‘The FBI is Out of Control, Need to Halt Funding’ https://t.co/YMRrE6DNUQ"
1605599719874519041,2022-12-21 16:22:58+00:00,1587,276,‘HIRE AMERICANS!’ Jordan Dunks on Biden for Planning to Lower Inflation By Hiring Migrants https://t.co/BxfZZVhhQb
1605594244214935555,2022-12-21 16:01:12+00:00,332,36,"LEGEND GONE: Steelers Hall of Famer Franco Harris, Known for ‘Immaculate Reception,’ Dies at 72 https://t.co/jjp0o6WwRm"
1605588097571381250,2022-12-21 15:36:47+00:00,124,14,"MEET THE MET! Superstar Carlos Correa Signs 12-Year, $315 Million Dollar Deal With Mets https://t.co/LTJJ6K4dUs"
1605582167425400835,2022-12-21 15:13:13+00:00,11445,1231,LAKE OF FIRE: Kari Says ‘Christmas Came Early —We’re Taking These Bastards to Trial!’ https://t.co/9VTf5P9A7B
1605348245294678017,2022-12-20 23:43:42+00:00,962,237,Twitter Files latest release: Over 150 emails exchanged between FBI and Twitter Trust and Safety head https://t.co/PTFBprZM3e
1605333917367771138,2022-12-20 22:46:46+00:00,1669,200,LEADER OF THE PACK: Trump Still on Top in Recent Poll on 2024 Candidates https://t.co/Ao5yfz1IdX
1605325148986511362,2022-12-20 22:11:55+00:00,551,155,"WHAT THE WOKE?! Spending Bill Includes Cash for Equity Institute, Anti-Racism Labs https://t.co/BdERU37mHw"
1605319576291516417,2022-12-20 21:49:47+00:00,114,38,@SaraCarterDC Federal law enforcement officials are very concerned on migrant swells https://t.co/tps1dH7biP
1605313753393860608,2022-12-20 21:26:38+00:00,20,3,@RonJohnsonWI Biden admin couldn't care less about the border crisis https://t.co/AkVOTxULEr
1605306358051573764,2022-12-20 20:57:15+00:00,799,160,Alan Dershowitz and @greggjarrett on Jan. 6 Committee's Trump criminal referral: This is unconstitutional https://t.co/NcNP3C1Rjc
1605296348965883912,2022-12-20 20:17:29+00:00,2066,335,White House Can’t Answer What VP Kamala Harris Has Done To Help Border Crisis https://t.co/vp3N9w3fzs
1605283474461663233,2022-12-20 19:26:19+00:00,238,67,DEM PRIORITIES: Biden Admin Looks to Fight Homelessness With ‘Gender-Affirming’ Services https://t.co/63sUKAFaIB
1605277475428261888,2022-12-20 19:02:29+00:00,345,99,ANOTHER BORDER BUNGLE! ICE Training Videos Reveal 150K Migrants Lost Due to Lack of Processing https://t.co/8T2NGVgOpP
1605263390146023424,2022-12-20 18:06:31+00:00,901,171,"‘BORDER CZAR’ SPEAKS: Kamala Blames GOP for Border Crisis, ‘Unwillingness to Engage’ https://t.co/DAAg7uq54w"
1605248902436978689,2022-12-20 17:08:57+00:00,626,109,"IT’S WIDE OPEN, KARINE! Press Sec Blasted for Claiming Border ‘Not Open,’ Says Disagreeing Helps Smugglers https://t.co/m2udYDdAhI"
1605242464536862720,2022-12-20 16:43:22+00:00,775,109,‘CLEAR POLITICAL BIAS’: RNC Demands FEC Reopen Hunter Biden Censorship Investigation https://t.co/bYCKx5j1ZM
1605236324231004161,2022-12-20 16:18:58+00:00,515,92,The Media Salivates Over The Meaningless Jan 6th Referrals Against Trump @GreggJarrett https://t.co/knZ0NJETGM
1605222376509251584,2022-12-20 15:23:32+00:00,4296,434,"‘FAR FROM OVER’: Lake Gets Win, AZ Judge Says Two Election Challenge Claims Can Go to Trial https://t.co/WpquEesx1Y"
1605214116137803776,2022-12-20 14:50:43+00:00,7829,867,"TRUMP FIRES BACK AT J6 CMTE: ‘When They Come After Me, It Makes Me Stronger’ https://t.co/r5iHc8tFrd"
1605088688236630018,2022-12-20 06:32:19+00:00,704,177,White House Press Secretary: Biden Has No Plans To Visit Border Amid Illegal Immigration Crisis https://t.co/NFIOmBvfl2
1604993559668588553,2022-12-20 00:14:18+00:00,1652,234,"‘TITLE’ FIGHT: Chief Justice Roberts Rules Title 42 Must Remain In Place, Halts Order to End It https://t.co/5AV4Nub4Mw"
1604942946146590736,2022-12-19 20:53:11+00:00,613,103,STUMBLIN’ JOE: New Poll Shows Dems Not Crazy About Biden 2024 https://t.co/gHKNi81FSQ
1604934091597545474,2022-12-19 20:18:00+00:00,1216,182,BREAKING: Jan. 6 Cmte. to Issue Referrals to DOJ Recommending Trump Be Criminally Prosecuted https://t.co/ZS9zDizQ2U
1604927986960138240,2022-12-19 19:53:44+00:00,897,161,‘CONSTITUTIONALLY TROUBLING’: GOP Investigating FBI’s Relationship With Social Media https://t.co/orhIvsc6BK
1604921068761874432,2022-12-19 19:26:15+00:00,3328,517,THE GREAT ONE: How the Hell Do You Not Appoint a Special Counsel to Investigate Joe Biden?! https://t.co/iWHZYyCdXL
1604912612667523081,2022-12-19 18:52:39+00:00,4526,1286,JUST IN: FBI Contacted Twitter Hours Before Post Broke the Hunter Biden Laptop Story https://t.co/mF2MtUmf43
1604906547095765009,2022-12-19 18:28:33+00:00,832,197,HAPPY…SWASTIKA?! Times Blasted for Shape of Crossword Puzzle on First Day of Hanukkah https://t.co/tvwGrOlv77
