id,created_at,favorite_count,retweet_count,text
1626663925851820033,2023-02-17 19:24:36+00:00,851,132,"VANCE TO EPA: ‘If You Think The Water is Safe, Take a Sip!’ [VIDEO] https://t.co/yH4yloFhck"
1626658097518239766,2023-02-17 19:01:26+00:00,463,56,‘DON HAS THE DAY OFF’: Lemon Sidelined After Comments on Nikki Haley [VIDEO] https://t.co/PumiTPPDRL
1626657520356843537,2023-02-17 18:59:09+00:00,729,65,McCARTHY AT THE BORDER: ‘We’re Going to Fight to Stop the Fentanyl’ [VIDEO] https://t.co/gRBO39znen
1626651159254409216,2023-02-17 18:33:52+00:00,380,108,NO RELIEF! White House Explains Why it Denied FEMA Assistance to Ohio https://t.co/5hgV7Kwl5u
1626644846541783040,2023-02-17 18:08:47+00:00,1030,124,LEADER OF THE PACK: Trump on Top in Latest Morning Consult Poll https://t.co/9IHWZR7dQN
1626632930767274006,2023-02-17 17:21:26+00:00,454,89,"VANCE IN SHOCK! Watch What JD Vance Discovers in a Creek Bed in East Palestine, Ohio [VIDEO] https://t.co/eVhMyIc529"
1626624705057652739,2023-02-17 16:48:45+00:00,2029,343,HE’S NOT FIT TO SERVE LUNCH! Biden Gets Clean Bill of Health Without Cognitive Test https://t.co/y7p5gKMeJT
1626618221208936449,2023-02-17 16:22:59+00:00,5477,651,‘HE SHOULD RESIGN’: Prominent GOP Members Blast Buttigieg for Total Train Failure [WATCH] https://t.co/40PQ8DlR2N
1626602394275422209,2023-02-17 15:20:06+00:00,887,93,DUMB DON: CNN Staffers Angry at Lemon for ‘Stupid’ Nikki Haley Comment https://t.co/pDnhGq3fDN
1626584033768669191,2023-02-17 14:07:08+00:00,482,50,China should be the No. 1 suspect behind aerial objects https://t.co/pOJyqsxyC3
1626490533840404480,2023-02-17 07:55:36+00:00,330,115,"Investigation found Mexico pharmacies selling medication laced with Fentanyl, Methamphetamine https://t.co/DuuaL8VqUT"
1626425951201419264,2023-02-17 03:38:58+00:00,983,352,Then VP Joe Biden’s brother ‘secretly negotiated $140M deal with Saudi government’ https://t.co/cqXesbu8Xh
1626398542917955585,2023-02-17 01:50:04+00:00,176,24,"THE GREAT AMERICAN PANEL: Inflation is so bad that it's impacting the Tooth Fairy! TONIGHT on ""Hannity,"" we'll give you the details and @JimmyFailla, @PamBondi and @JoeConchaTV will weigh in!"
1626396038872408064,2023-02-17 01:40:07+00:00,587,179,"OHIO DERAILMENT DISASTER: FEMA reportedly rejected Ohio’s plea for federal assistance in the aftermath of the disastrous train derailment. TONIGHT on ""Hannity,"" @DoctorJanette and @LeeZeldin will discuss."
1626393527256027136,2023-02-17 01:30:08+00:00,97,15,"HANNITY HOT SEAT: Tune into ""Hannity"" TONIGHT to see @GeraldoRivera and @CharlesHurt debate President Biden's latest remarks!"
1626391015274778633,2023-02-17 01:20:09+00:00,194,27,"BIDEN ADDRESSES UFOs: President Biden still doesn’t know what the U.S. shot down! Plus, ""Hannity,"" Virginia Gov. @GlennYoungkin and South Dakota @GovKristiNoem will discuss their efforts to protect their states from China TONIGHT on Hannity."
1626359438352293888,2023-02-16 23:14:41+00:00,1093,211,FETTERMAN ‘DEPRESSED’: Keystone State Senator Checks Into Hospital for Mental Health Issues https://t.co/hRR5J5xFHA
1626335687338258435,2023-02-16 21:40:18+00:00,212,42,Source familiar with Biden classified documents investigation says FBI searched the University of Delaware https://t.co/B6k33McRNM
1626330022104408066,2023-02-16 21:17:47+00:00,498,76,BUFFOON TALKS BALLOONS: Watch Joe FINALLY Address Spy Balloons https://t.co/PDRejMFHzC
1626310425359880192,2023-02-16 19:59:55+00:00,1134,234,JOE SHOULD JUST NEVER SPEAK AGAIN: Biden Calls Maryland’s First Black Governor ‘Boy’ [VIDEO] https://t.co/Xa13aCVi5b
1626304912421269508,2023-02-16 19:38:01+00:00,374,64,"LEMON SQUEEZED: Don Steps in It, Tries to Explain When Women are ‘In Their Prime’ [VIDEO] https://t.co/aXEexe5ZkA"
1626299751778975747,2023-02-16 19:17:30+00:00,191,42,American Workers' Real Wages Decrease Again In January As Inflation Rises More Than Expected https://t.co/OQSBDD49ca
1626294509028900867,2023-02-16 18:56:40+00:00,829,145,"PETER PANNED! Watch Ohio Residents ERUPT, ‘Where’s Pete Buttigieg?!’ https://t.co/V9cJplmyCI"
1626289368305397763,2023-02-16 18:36:15+00:00,434,130,NOTHING TO SEE HERE! Chemical From Ohio Train Crash Becomes WW1 Chemical Weapon When Burned https://t.co/wNUxIZfjGZ
1626278222605299712,2023-02-16 17:51:57+00:00,452,66,‘HE’S NOT A YOUNG 80’: Former White House Doc Shreds Biden Over Health Concerns https://t.co/ReUccCdkV9
1626272627156307969,2023-02-16 17:29:43+00:00,688,98,"‘SPIRIT’ WEEK: Non-Stop Prayer at Christian College Goes Viral, Attracts Students from Out of State [VIDEO] https://t.co/gi9oaHRBu9"
1626267023050215429,2023-02-16 17:07:27+00:00,37,6,@NikkiHaley  We need a new generation of fighters https://t.co/Z3mfPpJrNc
1626260802704486401,2023-02-16 16:42:44+00:00,245,61,"LISTEN NOW: Audio Released of F-16 Pilots Intercepting Spy Balloon, ‘It’s Pretty Small’ https://t.co/VLDTXkPjSk"
1626255188724948995,2023-02-16 16:20:26+00:00,544,69,"HEY, TONY! CHECK YOUR MAILBOX! GOP Kicks of COVID Probe, Sends Fauci a Letter https://t.co/PAofKjvRKv"
1626249690894282754,2023-02-16 15:58:35+00:00,97,19,@SenJohnKennedy Grills Climate Witness: How Much Will Spending $50T Lower Temperatures If India and China Do Nothing? https://t.co/85BS4cgmQL
1626244094367334402,2023-02-16 15:36:20+00:00,522,63,CHAIR JORDAN: Judiciary Committee Subpoenas Big Tech Execs on Collusion Suspicions https://t.co/PC1Q3jzNnJ
1626238088870772739,2023-02-16 15:12:29+00:00,849,142,ELON GONNA ELON: Musk Torches One-World Government at World Government Summit [VIDEO] https://t.co/S0CTx5nrcF
1626233167442247684,2023-02-16 14:52:55+00:00,479,130,American Workers' Real Wages Decrease Again In January As Inflation Rises More Than Expected https://t.co/RfrL85w8CF
1626219097813057537,2023-02-16 13:57:01+00:00,832,120,Sen. Kennedy to Witness Saying He Believes Xi Jinping on Climate: ‘Do You Believe Jimmy Hoffa Died of Natural Causes?’ https://t.co/syTmyf9zC5
1626036159011860480,2023-02-16 01:50:05+00:00,525,66,HANNITY EXCLUSIVE: House Judiciary Committee Chairman Rep. @Jim_Jordan has subpoenaed Big Tech executives as part of his investigation into their collusion with federal agencies to censor free speech. Tune in at 9 PM ET or set your DVR for this EXCLUSIVE interview!
1626033654244732928,2023-02-16 01:40:08+00:00,261,34,"""THE GREAT ONE"" RETURNS: @MarkLevinShow is calling out President Biden's lack of communication with the American people! ""The Great One"" will give his analysis TONIGHT on ""Hannity."""
1626032343956836353,2023-02-16 01:34:55+00:00,203,28,"NIKKI HALEY LAUNCHES 2024 CAMPAIGN: @NikkiHaley will join ""Hannity"" TONIGHT for her first televised interview since launching her presidential campaign. This is an EXCLUSIVE interview you don’t want to miss!"
1626021671458021376,2023-02-16 00:52:31+00:00,574,142,"Biden Responds To Bad Inflation Report, Falsely Claims Inflation Fell Last Month https://t.co/eLfdItmaKw"
1625973158162432043,2023-02-15 21:39:44+00:00,806,74,Our country might be better off if aliens ran the White House @hawleyMO https://t.co/2FZ8QdmL2h
1625966991235317785,2023-02-15 21:15:14+00:00,647,101,SHE WAS A QUITTER! Pompeo Blasts Haley for Leaving Trump Admin Before Major Accomplishments https://t.co/oJZjfUUh1L
1625961174490644485,2023-02-15 20:52:07+00:00,215,41,@RepMTG calls out AOC for refusing to debate on Green New Deal: 'She's chicken' https://t.co/bDH8bUXbNM
1625950012843692049,2023-02-15 20:07:46+00:00,1272,364,"FOUR FLED IN OHIO! CNN, ABC, NBC, CBS Barely Covering Ohio’s Toxic Train Wreck https://t.co/FhoYHq9JVs"
1625933820477247490,2023-02-15 19:03:25+00:00,673,102,Americans are being kept in the dark under the Biden admin https://t.co/NzUvIR7Vm5
1625925651256442885,2023-02-15 18:30:58+00:00,382,104,‘WEEK’ SAUCE: U.S. Intel Watched Chinese Spy Balloon for a Week Before it Entered U.S. Territory https://t.co/N9CgvyWlVX
1625918632726233091,2023-02-15 18:03:04+00:00,202,33,"TRUE BLUE: Watch NYPD Officers Save Children, Clear Streets During U-Haul Rampage https://t.co/u361ebd1Sk"
1625912826886750226,2023-02-15 17:40:00+00:00,232,37,"WHOOPSIE! Goldberg Calls Senator ‘Black Tim Scott,’ Confuses with Rick Scott —Senators Clap Back! https://t.co/RrelvlMDMn"
1625907753888755715,2023-02-15 17:19:51+00:00,329,54,NOBODY TOLD DIANNE?! Feinstein Seems Surprised That Her Staff Announced She’s Retiring https://t.co/XzrcOuGbUi
1625900588503298048,2023-02-15 16:51:22+00:00,750,87,WATCH MTG WHOOP AOC: ‘She Has REFUSED to Debate Me on the Green New Deal —She’s Chicken!’ https://t.co/8GtDBFKMXy
1625895331073347586,2023-02-15 16:30:29+00:00,127,28,COURTROOM CHAOS: Watch Courtroom Erupt as Man Rushes at Buffalo Mass Shooter https://t.co/pAKZ9sEEZV
1625881709248913408,2023-02-15 15:36:21+00:00,247,39,THE GREAT COMMUNI…YA KNOW…THE THING: KJP Says Biden Best Communicator in White House https://t.co/hMxCeoeudg
1625876090399883266,2023-02-15 15:14:01+00:00,241,38,PRESS PLAY: Watch Team DeSantis Put ‘Journactivist’ ON BLAST! https://t.co/ksFxO9wUgu
1625870945624760323,2023-02-15 14:53:35+00:00,1090,206,The climate alarmist cult has been noticeably silent as dead whales continue to wash up on beaches and a derailed train spills toxic chemicals into the air in Ohio. @saracarterdc https://t.co/n8icK4I0Yv
1625858901311918090,2023-02-15 14:05:43+00:00,105,21,@TomiLahren  This is another level of the lawlessness https://t.co/NTAJ83m4Br
1625673773092425729,2023-02-15 01:50:05+00:00,138,13,"VALENTINE’S DAY DEBATE: Is Valentine's Day a fake holiday or the most romantic day of the year? TONIGHT on ""Hannity,"" we'll ask @TomiLahren and @TheLeoTerrell!"
1625671248607936515,2023-02-15 01:40:03+00:00,588,106,"CLIMATE CULT HYPOCRISY: The climate alarmist cult has been noticeably silent as dead whales continue to wash up on beaches and a derailed train spills toxic chemicals into the air in Ohio. TONIGHT on ""Hannity,"" @RepMTG will weigh in."
1625668767672934401,2023-02-15 01:30:12+00:00,600,107,"BIDEN FAMILY CORRUPTION: President Biden's brother Jim was reportedly asked to negotiate a multi-million-dollar deal with Saudi Arabia. @JoshTBoswell will join ""Hannity"" TONIGHT with more details, and Rep. @JamesComer will react."
1625666225530368000,2023-02-15 01:20:06+00:00,211,39,"OH DERAILMENT EXCLUSIVE: @SaraCarterDC will join ""Hannity"" TONIGHT with an EXCLUSIVE report from the aftermath of the train derailment in East Palestine, OH. Tune in at 9 PM ET or set your DVR for this EXCLUSIVE report!"
1625663711166726144,2023-02-15 01:10:06+00:00,230,26,"""WE WORKED WITH CANADIA"": Karine Jean-Pierre said the U.S. worked with ""Canadia"" to shoot down an unidentified object. TONIGHT on ""Hannity,"" we'll show you the clip and @JoeConchaTV will react."
1625661193426812931,2023-02-15 01:00:06+00:00,199,31,"S THE TRUTH OUT THERE? Republican senators say today’s classified briefing only raised more questions about the UFOs the US shot down. TONIGHT on ""Hannity,"" Senator Josh @HawleyMO will discuss."
1625632086827626502,2023-02-14 23:04:26+00:00,587,111,Hunter Biden's Strategy to Defy Congress Invites his Criminal Prosecution @greggjarrett https://t.co/veKjY9ShXm
1625626049349402625,2023-02-14 22:40:27+00:00,479,59,"YOUNG, SPRY FEINSTEIN RETIRES: Oldest Sitting Member of Senate Retires at 89-years Young https://t.co/dCzjdQiafU"
1625620442789875712,2023-02-14 22:18:10+00:00,0,0,@MarkTEsper It's absolutely a major breach https://t.co/kMMTrQLZBF
1625614351922040832,2023-02-14 21:53:58+00:00,480,65,ROGAN DESTROYS STELTER: ‘He’s Basically a Prostitute’ https://t.co/9xCmCAKulp
1625608406110183436,2023-02-14 21:30:21+00:00,172,39,The EPA has more than 100 tests scheduled after East Palestine disaster @RepBillJohnson https://t.co/IGJzUzvS0D
1625602542670340097,2023-02-14 21:07:03+00:00,306,53,My fellow pilots and I started noticing ‘objects’ once we upgraded our radars: Former Navy pilot Ryan Graves https://t.co/pydgd1c3rE
1625596842837680149,2023-02-14 20:44:24+00:00,333,42,"CRUZ MISSILE: Senator Comments on Biden’s Balloon Busting, ‘He Finally Grew a Pair!’ https://t.co/0fRA94ts6E"
1625588280824586257,2023-02-14 20:10:22+00:00,242,38,"HALEY’S IN, TEAM TRUMP REACTS: ‘A Career Politician Whose Only Commitment is to Herself’ https://t.co/nFBmdJDpC5"
1625566768281358339,2023-02-14 18:44:53+00:00,941,124,BUILD THE WALL NOW: Sen. Ted Budd Intros Bill to Force Biden to Complete Border Wall https://t.co/Q9C7s0r1Oy
1625557271886405632,2023-02-14 18:07:09+00:00,882,123,"YOU DID NOTHING! Pompeo Blasts Biden for Balloon Fiasco, ‘The Whole World Saw’ https://t.co/qncDIJsTkz"
1625551815222693900,2023-02-14 17:45:28+00:00,1443,352,FOLLOWING THE SCIENCE: New Study Finds Face Masks Made ‘Little to No Difference’ https://t.co/70JAla9AxS
1625540850674458624,2023-02-14 17:01:54+00:00,5028,332,"LAKE OF FIRE! Kari Goes Viral for Refusing to Stand for Black Anthem, ‘I’m Here for THE National Anthem’ https://t.co/XuO7VbKtRI"
1625535704708141057,2023-02-14 16:41:27+00:00,1081,203,"HEY, PETE! OHIO IS BURNING! Transportation Sec. MIA on Horrific Toxic Train Derailment https://t.co/hsM62glJoc"
1625530338993733632,2023-02-14 16:20:08+00:00,154,47,‘GRID’ AND BEAR IT: Gav Pushes Renewable Energy in CA With the Electrical Grid on the Brink https://t.co/t90OZekN42
1625524132161941504,2023-02-14 15:55:28+00:00,200,20,"WATCH: Nikki Haley’s 2024 Campaign Launch Video, ‘We’re Blessed to Live in America’ https://t.co/MTxXqq2XWt"
1625516246593687553,2023-02-14 15:24:08+00:00,664,124,"WE WANT ANSWERS! JD Vance Releases Statement on Derailed Train, ‘Alarming Reports’ https://t.co/nEV3Ak9cQA"
1625496844666302471,2023-02-14 14:07:02+00:00,688,89,What is going on and where is your president? https://t.co/LjJ9TOtd1x
1625311373398769667,2023-02-14 01:50:02+00:00,284,49,"WEAPONIZED AND POLITICIZED: Even more evidence of the politicization and weaponization of our federal agencies has come to light! TONIGHT on ""Hannity,"" we'll give you the shocking details, and @DevinNunes and @GreggJarrett will discuss."
1625308869877460994,2023-02-14 01:40:06+00:00,429,84,"OFF THE RAILS: Instead of discussing the train derailment in Ohio, Mayor Pete opted to joke about balloons. TONIGHT, @RepBillJohnson (R-OH) will join ""Hannity."" PLUS, @GeraldoRivera will try to defend Buttigieg in the Hannity Hot Seat."
1625306357241978881,2023-02-14 01:30:06+00:00,178,33,"HOLDING BIG TECH ACCOUNTABLE: @SenTedCruz will join ""Hannity"" TONIGHT to discuss the Big Tech censorship investigation he just launched. Tune in at 9 PM ET or set your DVR!"
1625303839812222978,2023-02-14 01:20:06+00:00,532,74,"BIDEN BLAMES TRUMP: The Biden administration is still trying to place the blame for the Chinese spy balloons on the Trump administration. TONIGHT on ""Hannity,"" former Director of National Intelligence @JohnRatcliffe will respond."
1625301315260764161,2023-02-14 01:10:04+00:00,292,47,"ET BALLOON HOME? The Biden administration is working overtime to shut down rumors that extraterrestrials made the unidentified objects that were shot down over Alaska and Canada. TONIGHT on ""Hannity,"" former Navy pilot Ryan Graves, who encountered a UFO, will weigh in."
1625298812926320641,2023-02-14 01:00:08+00:00,180,30,"MORE UFOS: The Biden administration says the three objects shot down over the weekend posed a “very real” threat to civilian air traffic. TONIGHT on ""Hannity,"" former Defense Secretary @MarkTEsper will give his analysis."
1625232127183691794,2023-02-13 20:35:09+00:00,724,98,"GOD SQUAD: AOC Really, Really Didn’t Like That Jesus Super Bowl Commercial https://t.co/kFbkyOxZaR"
1625226699578155013,2023-02-13 20:13:35+00:00,872,253,"SHOCKING FOOTAGE: Ohio Train Derailment Releases Toxic Chemicals, ‘We Basically Nuked a Town’ [GRAPHIC] https://t.co/nG6zzQBS1A"
1625219972182974466,2023-02-13 19:46:51+00:00,1107,307,SON OF A GUN: Comer Reveals the Secret Service Tried to Bail Hunter Biden Out of Some Gun Charges https://t.co/gmtCh1gnIs
1625214287269576706,2023-02-13 19:24:15+00:00,1333,150,LEMON FADE: Disastrous Don Leads CNN Morning Show to Lowest Ratings in a Decade https://t.co/2MK09F22Aq
1625193477494476808,2023-02-13 18:01:34+00:00,731,120,‘DELUSIONAL JOE!’ Sen. Johnson Blasts Biden for Being ‘Detached from Reality’ on China https://t.co/IOjjJb6Vzd
1625182771692945409,2023-02-13 17:19:01+00:00,360,65,JOE’S JOKE OF A BORDER: 156K Migrant Encounters Logged at Southern Border in January https://t.co/7u3i6k1hul
1625174544578125824,2023-02-13 16:46:20+00:00,795,117,"TIME TO GET TOUGH ON CHINA, JOE! Comer Blasts Biden, Problem ‘Bigger Than Spy Balloons’ https://t.co/jZnLLpG6Ze"
1625169138497863690,2023-02-13 16:24:51+00:00,378,67,JOE AIN’T TALKING: Watch Biden Duck Spy Balloon Questions https://t.co/PEQ5TaljIG
1625164043349639175,2023-02-13 16:04:36+00:00,1749,128,WATCH: Chris Stapleton Brings Down the House With National Anthem Performance https://t.co/H4LiBvnYuk
1625158853514911746,2023-02-13 15:43:59+00:00,496,73,"DON, SET, HUT! Watch Trump Make $1M Throw for Charity in 1992 https://t.co/qfWigcnEtS"
1625153113035350016,2023-02-13 15:21:10+00:00,132,19,FLOCK OF EAGLES: Watch Philly Fans Go Into a Frenzy After Heartbreaking Loss to Chiefs https://t.co/OFjF2XjB8J
1625102585668534280,2023-02-13 12:00:24+00:00,819,74,Biden needs to send a signal that no one can violate America's sovereignty @AriFleischer https://t.co/qXsFpLWfbo
1624849761047027717,2023-02-12 19:15:45+00:00,482,69,"""It was clear that none of the democrats wanted to talk about the hearing’s subject"" @JonathanTurley https://t.co/LLdOMLbeXJ"
1624744627348684802,2023-02-12 12:18:00+00:00,612,62,"@RonDeSantisFL Ends Mouse’s Self-Government, ‘There’s a New Sheriff in Town’ https://t.co/w0BC6rCXot"
1624613027617046528,2023-02-12 03:35:04+00:00,771,130,"The border crisis continues to spiral, including a stunning increase in Chinese nationals @SaraCarterDC https://t.co/7copUnSiYx"
1624580792608251906,2023-02-12 01:26:58+00:00,573,43,America's power on world stage is being challenged @repdarrellissa https://t.co/UD8bsHhbxC
1624519035927908358,2023-02-11 21:21:34+00:00,618,103,We're up against preventing a world order dominated by the CCP: Former secretary of defense We're up against preventing a world order dominated by the CCP: Former secretary of defense https://t.co/V9kxHYV0oP
1624441456176910337,2023-02-11 16:13:18+00:00,906,110,"Amid Scandals and Crises, Dr. Jill Biden Prioritizes a Grammy Pop-In https://t.co/lFUN2RLfrv"
1624375587904139272,2023-02-11 11:51:34+00:00,688,63,Kirby: U.S. Has No Plans On Returning Spy Balloon Debris To China https://t.co/aLlxkDEcP5
1624182700859850753,2023-02-10 23:05:06+00:00,494,77,"THE AIR UP THERE: U.S. Military Shoots Down High-Altitude Object 40,000 Feet Above Alaska https://t.co/yegu8BuL21"
1624155634546475008,2023-02-10 21:17:33+00:00,2566,276,SHS NUKES NEWSOM: ‘He Had to Run Ads Begging People to Stay in California’ https://t.co/WwtKc97RZb
1624148138662453281,2023-02-10 20:47:46+00:00,82,24,@SaraCarterDC  The weaponization always cuts one way https://t.co/ext6NT0QCJ
1624124841874817042,2023-02-10 19:15:11+00:00,6437,711,UKRAINE FATIGUE? Gaetz and 11 Lawmakers Intro Resolution to Halt U.S. Aid to Ukraine https://t.co/xA9V057PBF
1624113551135703040,2023-02-10 18:30:19+00:00,308,32,SEEING STARS: Watch Dallas Stars Fan Punched in Face After Using Racial Slur [GRAPHIC LANGUAGE] https://t.co/5sZeFjp1Z1
1624109232361463809,2023-02-10 18:13:10+00:00,364,61,SUPER DODGE! Joe to Bypass Traditional Super Bowl Gameday Interview; Report https://t.co/JW6oa1q7X2
1624102692258709536,2023-02-10 17:47:10+00:00,726,100,"RUNNING FOR THE EXITS: White House Comms Director Says ‘See Ya, Joe!’ https://t.co/yGb9GdzJon"
1624095817148641294,2023-02-10 17:19:51+00:00,6489,469,"BARR IS BACK! Rosanne Releases First Special in 20 Years, ‘My Pronouns Are Kiss My A**’ https://t.co/1U8MYUa5Nn"
1624090017588031521,2023-02-10 16:56:48+00:00,2200,346,"‘UNCONSTITUTIONAL ELECTION MEDDLING’: Watch Stefanik Expose FBI, DOJ, and Twitter https://t.co/zc8cpUeNI0"
1624083767793967105,2023-02-10 16:31:58+00:00,2919,381,"BOEBERT GOES BALLISTIC! Watch Colorado Rep Shred Twitter Execs For Shadow Banning, Censorship https://t.co/g1keqhiOFJ"
1624078658661908485,2023-02-10 16:11:40+00:00,1020,82,HERE’S THE ‘BUZZ’: Tim Allen Back as Buzz Lightyear for Toy Story 5 https://t.co/RGaskZMNkg
1624072885504471040,2023-02-10 15:48:44+00:00,195,45,de BLASI-NO! Ex-Mayor Eying Position as Labor Secretary in Biden’s Cabinet https://t.co/DtYEdhKIzO
1624047296177373187,2023-02-10 14:07:03+00:00,437,50,Justice has got to be blind https://t.co/GWB6OGzyYx
1623861833856610306,2023-02-10 01:50:05+00:00,143,20,"THE GREAT AMERICAN PANEL: Our Great American Panel featuring @JimmyFailla, @DagenMcDowell and @JoeConchaTV will discuss everything from the Democrats' potential 2024 nominees to the cost of your Super Bowl Party. Tune into ""Hannity"" TONIGHT at 9 PM ET or set your DVR!"
1623859318255673347,2023-02-10 01:40:05+00:00,340,25,"HANNITY EXCLUSIVE: Arkansas Governor @SarahHuckabee will join ""Hannity"" TONIGHT for her first TV interview since delivering a strong response to Biden's State of the Union. Don't forget to tune in at 9 PM ET or set your DVR!"
1623856784606724096,2023-02-10 01:30:01+00:00,1060,143,"ARE YOU PAYING ATTENTION, JOE? President Biden recently claimed that the American people would not pay attention to the GOP's investigation of Hunter and his family. TONIGHT on ""Hannity,"" @JudgeJeanine will weigh in."
1623854280439480321,2023-02-10 01:20:04+00:00,686,119,"HOUSE GOP VS THE DOJ: We’ll show you the dramatic highlights of the Subcommittee on the Weaponization of the Federal Government’s first hearing today. TONIGHT, @SaraCarterDC will join ""Hannity"" with a full report. PLUS, Rep. @Jim_Jordan and @RepMattGaetz will discuss."
1623796941208313858,2023-02-09 21:32:14+00:00,20,4,@JDVance1 responds to Gavin Newsom attacking Sarah Sanders https://t.co/ZcTNxHEv9g
1623788585576022016,2023-02-09 20:59:01+00:00,39,11,@cvpayne Biden is going after low-income earners https://t.co/BAHUV26RAC
1623775362231435265,2023-02-09 20:06:29+00:00,3627,275,419-0: House Passes Measure Condemning Chinese Spy Balloon https://t.co/xm363jK4a2
1623772502152314882,2023-02-09 19:55:07+00:00,92,15,@RepBoebert  Goes off on Twitter Hearing Witnesses over Her Account Ban: ‘Who the Hell Do You Think that You Are?’ https://t.co/9WGNyPEjSk
1623766429362184192,2023-02-09 19:30:59+00:00,974,177,WHO ARE ‘THEY’ JOE?! Watch Biden Tell Judy Woodruff ‘They’ Told Me Not to Speak https://t.co/SfOYtJbbbU
1623760209607892992,2023-02-09 19:06:16+00:00,513,60,BRITT AT THE BORDER: Freshman Senator Set to Introduce 4 Sweeping Immigration Measures https://t.co/h1PrhHtBeV
1623755835976429568,2023-02-09 18:48:53+00:00,545,80,CUOMO TAKES A SWIPE AT JOE! Ex-Gov Says ‘Southern States Were Right’ About Border Crisis https://t.co/TJhG0Ep4K1
1623749120862130178,2023-02-09 18:22:12+00:00,310,34,"SO LONG, BURT: Legendary Composer Burt Bacharach Dead at 94 https://t.co/i3CjdX7o7V"
1623742508877377539,2023-02-09 17:55:56+00:00,1561,220,JOE’S BRAIN STOPS WORKING: Does Anyone Know What is Going on Here?! https://t.co/ruEUZlncUZ
1623736066753585152,2023-02-09 17:30:20+00:00,2496,214,BIDEN BELLY FLOPS! Poor Joe Draws Second-Smallest SOTU Audience in Decades https://t.co/6jImrv4v3d
1623729882520748036,2023-02-09 17:05:46+00:00,886,132,‘THEY KNEW BIDEN WOULD BE WEAK’: Cruz Absolutely Destroys Biden’s Spy Balloon Reaction https://t.co/a0XmzFcd90
1623723266442420224,2023-02-09 16:39:28+00:00,1163,83,GOD ON THE GRIDIRON: Mahomes Says ‘My Christian Faith Plays a Role in Everything I Do’ https://t.co/eFV6Fm03Zt
1623717464176578564,2023-02-09 16:16:25+00:00,630,80,FETTERMAN HOSPITALIZED: Senator Getting Checked Out for ‘Feeling Lightheaded’ https://t.co/d98KXSnR3y
1623711557623468032,2023-02-09 15:52:57+00:00,635,144,The FBI’s sustained censorship campaign primed Twitter to eliminate the Hunter Biden laptop story @greggjarrett  https://t.co/bUX8qwmJ9y
1623705912748695553,2023-02-09 15:30:31+00:00,794,62,"POOR AS A CHURCH MOUSE: Mickey Hits the Skids, Disney Cuts Jobs as DeSantis Takes Control https://t.co/YYYSYiWzw9"
1623700599802929152,2023-02-09 15:09:24+00:00,834,85,‘COMPLETE LACK OF LEADERSHIP’: Pompeo Torches Biden in New York Post Op-Ed https://t.co/AM4cunoGKp
1623681499194183680,2023-02-09 13:53:30+00:00,2644,178,I was honored to call out Biden for the liar that he is: @RepMTG https://t.co/twrcDFsByL
1623670706868297733,2023-02-09 13:10:37+00:00,560,54,House Republicans grill fired Twitter execs https://t.co/v57kgCnzgf
1623484776416964608,2023-02-09 00:51:48+00:00,535,147,Biden's IRS Targets Middle Class Again https://t.co/d6z17tnvrt
1623456887776722944,2023-02-08 23:00:59+00:00,4158,304,"DeSANTIS DESTROYS DISNEY: Ron Ends Mouse’s Self-Government, ‘There’s a New Sheriff in Town’ https://t.co/J3WbQd6iY6"
1623423508125548545,2023-02-08 20:48:20+00:00,2247,201,"PANTS ON FIRE! MTG, GOP Scream ‘Liar’ After Biden Says They Want to Cut Entitlements https://t.co/AKw1PcHw4w"
1623418191820062723,2023-02-08 20:27:13+00:00,798,112,"WE’RE WORSE, JOE! New Poll Shows Half of Americans are Worse Off Than 12 Months Ago https://t.co/65liiogtE0"
1623411530636173312,2023-02-08 20:00:45+00:00,1381,187,"CAUGHT IN A LIE: McCarthy Blasts Biden for Lying at SOTU, ‘He Knew it Wasn’t True’ https://t.co/CTa7NYo2qO"
1623405280632471557,2023-02-08 19:35:54+00:00,1310,176,House Probe Vows To Unravel Biden Family Corruption As Hearings Begin @greggjarrett @peterschweizer https://t.co/ZjA0TWDKCX
1623399946438299651,2023-02-08 19:14:43+00:00,295,55,Border Crisis by the numbers: in January agents seize 500lbs drugs and 70 criminals with outstanding warrants https://t.co/ADJ1TVVEI6
